translated_text_no_emoji,emoji_labels
I feel smaller than the kit I'm wearing underneath. -feeling down ,[3]
Feeling someone Mirala.......,[]
How did I become passive during the strike...... feeling sick and lazy both. ,[2]
Why is human life like this?? -feeling upset ,[2]
Feeling sorry for myself! Life is nothing but a joke...,[]
Our school exam is starting on 23 november oofff feeling sad because of wearing something,[]
"Today's Bangladesh daily front page. Mockery everywhere, feeling annoyed. pic.twitter.com/7t9k6DVaGV",[]
Shakib Al Hasan is sad to think of Ashin number one ,[2]
Dhet Shamsur Rahman didn't get his century for 4 more runs... Really feeling sorry for him.. ,[2]
Is the heat of politics on my body or not? The body feels a little warm. The fever seems to have caught me. — feeling sick.,[]
I am very excited. Neither at home nor outside nor on campus  >,[2]
A day of failure! ,[2]
"Parihma gave it at such a wasteful time  I left the house around 12 o'clock, and I just came back ","[2, 3]"
"Being born in a middle-class family is ironic. I can't stand it, I can't say it either. Purai Maincare Chippa. ",[2]
Gulistan-TSC walk after fasting all day and iftar with 1 lpenlib..starving! ,[2]
Feeling so much sadness,[]
The trouble is that you gave that feeling UltO PalTa,[]
Oops! It's cold outside!!,[]
Boring!!!...... ,[2]
"When trust is lost, people no longer expect anything from him.... — feeling confused.",[]
"Don't know about anything else, but Ronaldo should be awarded the Ballon d'Or for the doggy face and distorted gestures >",[2]
Why is love helpless?,[]
"Shala human society is bad, in which society do we live?",[]
It's 4 am on the clock :-> I know why I don't want to sleep today  Never before..! #Feeling_matha_batha.,[2]
"Have they lost their minds...... all two fours 4, 6 Mairai out..... do you think you can win? #feeling_confused #sadik",[]
Food Porn is the most trashy site in the world. Their posts come out just when the stomach is running >,[2]
"Crack the cocktail or don't crack, strike today.. :-|  ","[2, 2, 2]"
"'I set you free, you can go far away happily, if you stay, you will not come back, I will find happiness in the crowd of hundreds of troubles............ ",[2]
The idea was stolen! Two years ago we were discussing to make a band called The Band. Everything is cool! ... http/fb.me/NtVby5ST,"[2, 3]"
Can't play more than 2 balls lately... ,[2]
"Brother, what did I see? :O Are you a virgin!!! :O fact true? — Sad but truth  http/ask.fm/a/9ob976p1","[2, 3]"
Bangladeshi injured in BSF firing at Haripur border   [ http/offlink.us/G7 ] Which country in the world is so defenseless... http/fb.me/2tMCo9c5b,"[2, 3]"
"I can see another eye shining behind your eyes, I can see it, I understand that you ran away with all my light.. ",[2]
Today my phone display is tarnished from hands down. ,[2]
I forgot what to say in Bengali to miss ,[2]
Strike for 4 days. And people are having trouble ,[2]
Just thinking about the class + makeup class after the strike makes my head hang ,[2]
"Time runs out, only memories remain......... ",[2]
Why don't you understand me ,[2]
I miss the moments of tomorrow very much. ,[2]
I prioritize my dreams more than my love. It cannot be said that the love will be lost in the dream.   ,[2]
The mind is very bad. . . too much . .   ,[2]
I just took the picture to have fun with someone. I got scared myself  Post to scare you... http/fb.me/XKGv3Hbi,"[2, 3]"
You ran away with all the light... ,[2]
"I was talking to someone about a headache in the afternoon, I woke up and saw that I had a terrible headache. . .  It's kinda ok now. . . .",[2]
I came home with so much difficulty to roam around but soon after I got sick  What is there in life ??,[2]
"If you go to the Facebook page, you will understand that even though 10,000 megawatts of electricity has been generated in the country, the light of knowledge has not yet spread. ",[2]
Life swings like a drop of water on a leaf... ,[2]
Israt Shithi's head is upset...and everyone in the house is also upset ,[2]
I came back from failure............... ... [[f9.sad]],[]
Haimanti Ray...I'm very mixed with winter rice.. ,[2]
"Shalar, hijra, spineless fac-rule  still don't understand there is no movement without movement http/fb.me/1L7k6TWxY","[2, 3]"
"When danger comes, it comes from all around ",[2]
Don't let a night as bad as yesterday's come into my life  I don't want such a night to come into anyone's life. Terrible helpless... http/fb.me/2hBeVIuUu,"[2, 3]"
His family is enough to ruin a man's career. I don't think it will be read anymore. ,[2]
There is a game of cricket and there is no Sachin Tendulkar - it will be empty to think.  Sachin Tendulkar,[2]
This was my best friend and Shukhi Rajkonna's daily routine in college  ... no friend but history... http/fb.me/PwXDM9n1,"[2, 3]"
Polada has been talking for two and a half hours. God bless ,[2]
I can't take this Abal Gular anymore. Halara goes on a date in the park every Friday. ,[2]
I lost my sleep because of the happiness of the end of the exam!! ,[2]
"If I had continued with the Degree (Hon's), it would have been 5 years, but it would not have ended!!   :S  #NationalUniversity of Bangladesh News ","[0, 2, 2]"
how does it feel When you want to mingle with the earth???? Definitely don't like it  feeling d same....*sigh*,[0]
Humayun Azad did not criticize Freud. Ekkebar is making perfect criticism. feeling ---- hot head >.< http/fb.me/6KRRTtM6i,[3]
The lack of countrymen is crazy!! Great lack of patriots!! ,[2]
Phone stickers are required to be purchased. I am in financial crisis.....  I have 4 rupees in my pocket ,"[2, 3]"
I know that Rakib Bhai has minimum 54 thousand taka in his card. But I don't understand how much he will take. ,[2]
"Even if the fever is reduced, the cold is not reduced.. ",[2]
"Aare, water is falling in Deiksha chouksh.  http/fb.me/2s4cMoS0w","[2, 3]"
No one can substitute for anyone. Love cannot be taken back.  #Nuhash_Humayun,[2]
In the last 4 days I slept only 6 hours!  I'm exhausted due to work pressure. 4-5 programs today on top of that... http/fb.me/1Q9XFz6ln,"[2, 3]"
It only takes a minute to pass out on Chuka St!!!  Goodbye world! Don't forget me,[2]
"If you want to know the behavior of NASA, why is NASA angry bro  http/fb.me/2cXtA7iDq","[2, 3]"
Mind.....I got your name in the wind....Mind......lost it in the wind........ ,[2]
"One night, one battle. ",[2]
"Life is a narrow path like a railway line, why do you feel so much... ",[2]
"Stopped going around. From now on, life in front of the TV at home begins. Only old memories are there.  pic.twitter.com/N801sP2UXs",[2]
Senior Sister + Junior Brother = A Happy Relationship !! Missing all my beautiful seniors ,[2]
Don't eat noodles > http/fb.me/Nn11vhQ9,"[2, 3]"
It could not be like that... but it is...  Unnecessary... Phew!!,[2]
#Rangpur er winter onk miss korci  #onek thanda naki abar #someone_give_me_the_cold_to_cover_this_is_big_miss ,[2]
"Indian ""Nawab Zaadi"" Haramzadi, why don't you reply my message...??  Give a blank reply once... Kata... http/fb.me/2Xu6meWXy","[2, 3]"
Silent poet in unexplained sleep...  ,[2]
99% people of our country understand only voting as democracy and voting is only a formality...  And... http/fb.me/1qVtZXtMA,"[2, 3]"
"Even if a goat pees, it never becomes a cow. As it is >",[2]
"Among almost all the male dancers known on TV, why do I notice a girly girly feeling? I do not understand the problem. ",[2]
"People will forget Sachin Tendulkar after he quits the game Because, India has now got few cricketers to fill the void ",[2]
"I should leave this country very soon, otherwise I will end up in politics ",[2]
"Marcelo, one of the best leftbacks of the time, is injured again!  Marcelo injured his knee in the training session yesterday. His left... http/fb.me/2xrrpsorI","[2, 3]"
I know why it feels so bad!!  I can't find the stairs under my feet.,[2]
"Everyone has changed, I couldn't change......being nostalgic ",[2]
"Saying with a chest pain ""I am a helpless Chuetian"".  ",[2]
"Biggest typhoon in history in Philippines, death toll exceeds 100  Biggest typhoon in history destroys three-story house in Philippines... http/fb.me/2wcMAgUrj","[2, 3]"
No more jamming ,[2]
"If you go out on the street, you die ",[2]
An Awami League leader was killed in a bomb attack in Jessore's Abhaynagar. ,[2]
"Rashikin Saddid my market t shash re mamma  I am shash! destitute, bankrupt ",[2]
I'm not feeling well... I went to sleep ,[2]
"Ashwin the world's best all-rounder? You will not beat me, I myself Moira Jamu? ",[2]
A seriously depressing post...  http/fb.me/Pt7bkp0h,"[2, 3]"
 So far more than 1200 people have been killed in the Philippines due to the terrible typhoon Haiyan.,[2]
"When I look at your picture, I feel like I forgot all the pain you gave me  It's like everything starts anew, a new... http/fb.me/32gZM2ClL","[2, 3]"
Love for money is dead today. ,[2]
headache ,[2]
"I failed, wounded, killed and shocked. This is the shot that #trisha gave me in the morning   ""amar baga... http/fb.me/18O9O1mUA","[2, 2, 3]"
Unable to talk with uneducated people. They can produce jam on mango trees. Unbelievable >,[2]
Slowly the good days of life are running out  But the dream remains elusive.,[2]
"The Rural Electricity Authority has stopped the unannounced power supply since 8 am, while the generator is broken.  The day is soil",[2]
"﻿#AkashDeep ""AkashDeep lights up . . ."" #Diwali coming...The #Festival of #Light is near. #HappyDiwali  Happy #Deepabali https/www.facebook.com/photo.php?","[0, 3]"
"#good_night_शुवरात्र A sun is setting again, a night is being born!! http/buff.ly/18ZO47f pic.twitter.com/TIWS6WNpMy",[3]
"* Good Morning * Did anyone wake up? But I'm getting up.. If you get up, please like and comment. It's a little early in the morning... http/fb.me/1wi7IrN1K",[3]
* good night * . . . * GOOD NIGHT *,[]
;-):-D:-D Pakistan is losing what fun!Proteus and the beauty,[0]
@FarahPiani: All the trouble is with me!  Because you are a trouble yourself,[2]
@iam_koni Didi: I thought Manna Dey's song will play a lot on channels; Didn't ring! Only news: 'His death'!,[]
@jeet30 Good Night sona dada.....good night ,[0]
@SarimKhan well done ,[0]
@shreyaghoshal Good night. stay well  ,[0]
"@We_Love_Mir May this auspicious day of the year paint you with all its colors, May every moment of the festival be brighter. Eid",[]
" Good Morning  Sleep Sleep At the end of the night, the sun rose again, smiled, and the light of the morning,, have a good day everyone.. Started... http/fb.me/6BeAosu4y","[1, 3]"
12-15 The shop was set on fire ,[2]
"Best couple of 2013, everyone pray  http/fb.me/2sIu8H2Dk","[0, 3]"
"Alhamdulillah, I can walk  http/fb.me/2I3zdqeGm","[0, 3]"
AmnI ColD n Fever A seSh hYa JaiTesi TaR upoR abR polApaIn futo tagayna start kasse    #कोयजेज़मुबपु !!!,"[2, 2]"
Asian Music Hour on Asian Tv at eleven o'clock. Enjoying it ,[0]
"Describe what a good friend means to you? — Someone you can talk to for hours for no reason, saying the same thing over and over... http/ask.fm/a/a045hbni",[3]
Eating chicken Feeling fox  ,[0]
Feeling - sleepy but I don't want to do anything,[]
Feeling a sad  I don't want to see the pages in the name of love.....,[2]
Feeling what is on the forehead! ,[2]
Feeling-nausea listening to Khaleda's phone conversation.,[]
FIFA OSTs are now very popular ,[0]
"Good Morning .. someone's emotions. Don't give love, give love of heart............. because emotional love will one day lose to conscience",[]
Good night Facebook!,[]
Happiness Is 184 to take the target Pakistan 182 all out !! 1 run Hira went! 6 wickets in the last 17 runs!!  ... http/fb.me/SNROUiGh,"[0, 0, 3]"
Happy birthday Maa !! Love you!! Happy birthday mom!! pic.twitter.com/aeCrMFBn6R,[]
Hi frnds good morning. I am the new admin of this page #ovi...... ,[0]
"How to make a woman happy? — Take someone named ``Happy'' to that woman, and she will say, ``Happy!!!!!'' ... http/ask.fm/a/a0hn779i",[3]
"http/www.youtube.com/watch?v=AC_QkM3iMNY … Oysters, my dear, if someone wants to take them away, I will give them death!  own... http/fb.me/19ccPZF8w","[0, 3]"
I was taking bath in the bathroom... suddenly I am feeling something is coming up by my feet!!! I was just shocked! I... http/fb.me/12U0RpSnk,[3]
Like our post or comment to be always with us. Thank you. “Bismillahir Rahmanir Rahim” Assalamu Alaikum... http/fb.me/30vriOCPw,[3]
"Now I'm at kazir dewri, Kazi Bari Ln, Chittagong http/goo.gl/maps/kS7MV Chatting with friends after a long time ","[0, 3]"
Really??!! Everything is possible for seventy-one TV! http/fb.me/34UyrH9x5,[3]
"Sunday-Monday & days wanna kill you again and again!! > [If anyone has a heart problem better not show, I go… http/fb.me/6wYDT2Phm","[2, 3]"
Tor Dabi Ta Ki Vai? ? ? ?    #feeling confused,[3]
wow!! the snail is fast  Enjoyed watching Tarbo ,"[0, 0]"
"There is a little gap in the past, let's go forward for now   When the past topic comes up, I want to go forward ","[0, 0]"
Sometimes tears have to be turned into fire ,[2]
Stepping into Barisal after a long time feels like one's own city. I am feeling different.,[]
"Anant Jalil Bal , and Unreal Stuff by Hindi Nayaks are also good. Typical Bengali ",[2]
"I understand how bad the waiting is when... . . . . . . . . . By downloading something, I sit for it! ",[2]
Meaningless world....brutal everything... .the onslaught of despair... ,[2]
Dishonest company should always be avoided ,[0]
"Earlier, when it was night, I, my brother, Shaan, Saif, Chakku used to sit with tweets. And now it is empty. ",[2]
The flames don't stop (,[2]
Today in life I heard the voice of the cocktail so closely.  I'm scared ,"[0, 2]"
Why is everything so quiet today? There is a pansa pansa taste in everything  Is it just me or yours too?,[2]
"Today I am saying goodbye to all my friends... If I am alive, I will meet again tomorrow, we will talk.... good night my sweet frndzzzzzzzzzzzzzzzz","[1, 1]"
Pity only boss \Mashrafi/ didn't get a wicket,[]
You are our benefactor......... really you are incomparable  http/fb.me/11gm9RgFW,"[0, 3]"
We have nowhere to go. So I am sitting. ,[2]
"See the smile on our little Musi's face? If a wicket is taken, the first person runs to the bowler  kaiF",[0]
Amused by the practice of spelling mistakes in scrolling our TV channels ,[2]
I really miss Saka Chowdhury a lot! He is the only Dildar in Bangladesh politics (talking about actor Dildar) ,[0]
One more day  Time never ends  Can't Wait For #ElClasico #ClasicFCB,[2]
May Allah return the form of Mahmudullah Riyad. Everyone says Amen ,[0]
"Feeling sick, getting lazy day by day ",[2]
"There was hope and love, today there is no hope and no love  ",[2]
"Astaghfirullah, deprived of listening to Begum Zia's lecture, Karlu Ludshedding ",[2]
"Say a word slowly everyone, hear me say, ............GOOD NIGHT..............",[]
"In fact, after being shot, he was dragged to the side of the road in such a way that everyone thought he was dead ",[2]
I want to go to Ireland. Why is Ireland so beautiful?????? Feeling so much romantic!!!!,[]
In Sha Allah we will win tomorrow ,[0]
"Our Marcelo Mamou is injured,  He will miss the upcoming matches for Brazil. Get well soon... http/fb.me/1SchXD9CD","[2, 3]"
Interesting......,[]
"Yes, it is important to have this law in Bangladesh...  http/fb.me/1Pgnq34c6","[2, 3]"
Oops! My feet hurt so much ,[2]
"How do you understand me so much in these few days? u simply mk me feeling so lucky to hv a frnd, a person lyk u in my life... #goody_woody",[]
The artist of this beautiful song is my friend Shahnewaz Piash  http/fb.me/159zpN917,"[0, 3]"
"I am on this side and you are on that side, the river flows in the middle.... Stay in any side, stay well dear Mannade — feeling sad.",[]
The future of this poor country is dark ,[2]
"Without a star star, Argentina is fighting at an even pace. Roar Argentina Argentina =1 (Mexi Rodriguez) Uruguay =1",[]
"A little while ago, 4 cars BGB came to our market! Faka Ilo Faka gone! ",[2]
Just dabbled in photoshop and whatnot  https/www.dropbox.com/s/bo8jc75ch533efu/Happy-New-Year-2014.jpg … http/fb.me/11fbyw7YT,"[0, 3]"
"One day a bird went to a white rose and said, I LOVE U then the rose told the bird that day I changed from white to red... http/fb.me/21msHj7Mv",[3]
"Agree! ""@dk_sadia: Happiness is sleeping with a fan on in October weather """,[0]
Exam !! Only hope strike  ,[2]
"From now on I don't have romantic, excited talk on the phone with my girlfriend anymore    I'm catching it in my ear  fear... http/fb.me/17aPN8VxM","[2, 2, 3]"
"Even after so much searching, I did not meet an honest and sincere person like me #feeling so sad",[]
"For so long, I called Allah in my heart so that Pakistan lost in 2 nights! Let's go! Even if it doesn't happen, it loses by 1 run!!  Remember... http/fb.me/3aY0kMgAu","[0, 3]"
"So much fever and cold and hunger! God knows the condition of the roads. For now, it feels bad to get wet in the rain. ",[2]
"Until now, I understood why Zia is called Shaheed Zia even though she was not martyred in the war!",[]
Its name is #Pakistan!!! #Fuck Pakistan win Bangla! ,[0]
Many Bod Bhai Martmaks in the area are injured and in street mode. There is no one to take to the hospital ,[2]
They will grow up to ride the car and I will cut the grass... ,[2]
"Hey Sophia, don't rob me anymore ",[2]
Oh! I lost  Virat Kohli is the world!! ,"[0, 2]"
Sometimes certain silences make people cry a lot.  ----Dreamless Baluchar.,[2]
"Loving someone from a distance is the most sacred love Because there is no impurity in this love, there is no physical need ",[2]
The work is not done by doing it,[]
Not being able to cry is also very difficult,[]
Looking forward to the 2nd Odiai tomorrow  Bangladesh vs New Zealand  Roar Tiger ,"[0, 0]"
"Tomorrow is October 25. I don't go out, I feel scared. feeling-dear",[]
Tomorrow our test results will be published. That's why now I feel very worried! (,[2]
What a strange girl  I didn't understand anything she said on the phone  Feeling confused ,"[5, 3]"
Care to show what game  http/fb.me/2K24Ujv0i,"[0, 3]"
There is love hidden in some Hate You ,[0]
"There are some people who can change themselves with time.. and those who can't, those are the ones who suffer the most in life... — feeling sad.",[]
To gain something or lose something. I come to earth only to lose Shala. —  feeling guilty.,[2]
No one spoke...  ,"[2, 3]"
"There is no one anywhere that I have walked today, that I have not found alone on the road, so really, who can be seen by the hand and said, I am not good... ",[2]
Once upon a time I was dry!!!   http/fb.me/17ihjmpdz,"[2, 2, 3]"
Sorry for the camera. Couldn't keep it at home ,[2]
"It seems that there is no travel written on the forehead this month!  Even though all the preparations to go to Kuakata were done last week, the bicycle... http/fb.me/1rPUMI3QK","[2, 3]"
when will i go back ,[2]
Comedy show between Hasina and Khaleda ,[0]
"If Khaleda Zia does not accept the invitation, I will go. Munchay to eat chicken! ",[0]
Khaleda is losing the script  Again 48 hours time  Good day ahead Give me 10 minutes to escape,[2]
Looking for you in the dream song today waiting for you Looking for you in the dream song even today I crave your touch ,[2]
It's one thing to trust too much and be The Great Gatsby ,[0]
Music has an unusual ability to make you happy even with pain.,[]
A cup of tea at dusk and my way to Artsail. feeling-lost,[]
Grrrrr head lost  I don't want to do so much work in winter ,"[2, 2]"
"Can't sleep masi-pisi come to my house, ......................................... .................Good night I told you to sit quietly.",[]
I don't understand that a little irregularity with sleep will hurt me like this... Result now Feeling headache Need deep sleep...,[]
Can't sleep in the light of Chad. The light is on the bed....the feeling is wonderful ,[0]
"Think about it, what to do...  If you like it, please like it, share it and let others see it. you...",[7]
Chidar Moa Khai Boisa Boisa.. The thing feels good to eat.. ,[0]
Manna De songs are being talked about on channels ,[2]
I combed my hair...  . .. ... .... I feel tired... ,"[2, 3]"
"Chagur is thinking that it is good that Khaleda has spoken like a brawler, who will understand these people who understand what the public understands ",[0]
I remember when I was little....how many chips I used to eat..... @feeling little kid  http/fb.me/6iov0Wn3G,"[0, 3]"
"I want to know, I really want to know, are you the same as before, or have you changed a lot? ",[2]
I was shocked to see teletalk 3G speed on GP modem ,[2]
"Giraffe...Giraffe...everywhere!!! Happy Giraffe Day!!! moral of the day: be a giraffe, make others a giraffe!!!""",[]
Downloading at 1mbps speed for the first time in my life.....that too sitting at home!!! Earlier speed was 25-30 kb. Bangladesh has come a long way ,[0]
It's good to hear jhagra...  On 71 TV... Hasina-Khaleda phone conversation..listening... ,"[0, 0]"
When you had no one I was the one  Now you've got everything I'm the one  ,"[0, 2, 2]"
"It's raining heavily, I don't want to leave the house ",[2]
If only in 1994 Bangladesh had taken the opportunity to join the optical fiber connection for free or now the average speed of the Internet in Bangladesh would have been 4MB! ,[2]
I don't like the painful mechanical life anymore..... ,[2]
Dhaka city Aisa my wear Jurail  feeling sheiram sheiram ,"[0, 3]"
Does that mean no one cares about Sujata Singh!!! Good ... Good ....,[]
"The last letter written to you remained unfinished due to the irony of time, so even in the midst of evolution, this 'I' is incomplete today... ",[2]
"But PM's sense of humor is good, must admit ",[0]
Watch youth idol Andu's speech. Had a lot of fun  http/fb.me/QT2ao0sp,"[0, 3]"
Stop and go.....  Painful mechanical life ,[2]
How did the two leaders fight? ,[0]
"There is nothing to ask for from the day and nothing to ask for...keep the sadness for tomorrow...for now, life isn't half bad ",[0]
"DELHI EXIT POLL: Congress loses, Padmaful falls in Delhi, good results for Aam Aadmi http/tinyurl.com/lexm4rs",[3]
"While sitting at home for a long time, the hands and feet are growing   Watching mina cartoon ",[0]
Miss you if you don't see  https/www.facebook.com/photo.php?v=4934222052265 …,"[2, 3]"
"Strike of sabotage Bombing by mercenary picketers, vandalism, arson  Life in the capital is about... http/fb.me/R10efc3s","[2, 3]"
I feel very helpless these days... ,[2]
You have to be more modern minded. ,[2]
"A sleepless night, accompanied by a chilling cold wind, and a huge sky and some darkness ",[0]
Naimaaaaaaaaar Goooooooooal asist ,[0]
Nokia's app store is filled with all the world's famous junk apps! >,[2]
I understand the debt.  http/fb.me/298VOHkqk,"[0, 3]"
The bird all ..............does Rob .........................says GOOD MORNING,[]
"Pashan world's Pashan people in exchange for Swath, everyone faints when they are far away, when pride comes near, acting people are cruel, this is their identity. — feeling sad",[]
"A large group of about 30 people, chatted together #feeling excited",[]
Beloved hangs on me. . ,[2]
"Father of the exam, you can open your mind and sing. This old man ended our life.  But I don't care anymore,... http/fb.me/6sO0hVafr","[2, 3]"
In every boy's life there is a girl whom he longs for but never gets... ),[2]
Ahsanullah University of Science and Technology as the first private university to get permanent certificate  http/fb.me/1COsDhMbK,"[0, 3]"
Mourning for the Filipinos ,[2]
I don't miss anything on Facebook. Except for @_Jaati_'s posts ,[2]
Facebook has been hacked again ,[2]
"Lying on the tree, touching your own sorrow, do not sleep, even sleep is selfish!!! ",[2]
I am watching the Bengali movie #The_Black made about the justice system of the pharaoh Diani Hasina of Bengal.. Download link in the comment.. feeling-amazing,[]
Bengali nation never forgets... Water and oil can never mix together. ,[0]
Dad! I did not know the meaning of my name. Now see SAIHAM means LORD!!  ,[0]
father and son How good it felt to climb into the arms of the father. Now I can't get on my father's lap anymore. Feeling sad  http/fb.me/1PzbHlRzy,"[2, 3]"
Messi's injury sadness in Barca's victory Open My Bangladesh http/fb.me/6ntZ8nTbj,[3]
"Baler is making a flyover, nothing is moving.... Muita wants to give aka feeling pissed.",[]
"I completed 1 year of unemployed life, unfortunately I didn't have that two-three months, after 1 year I got an order to wait again for 2/3 months. feeling stuck",[]
"Better  ""@Chhanda_: @sheikhriad1 so happy!! @DasSatabdi the girl is so good, so Lakshmi!  ""","[0, 1]"
"Barrister Rafiqul Haque is giving BNP a good bamboozle lately  Lol, now ATN News",[0]
"Due to the rain, it seems that today's game will not be stopped. That will be the draw. Mominul won't have a few more records from the middle...damn... ",[2]
"Your last letter is wet with rain water, it is torn, the word of the letter is lost in the unknown.. How can I tell you? feeling #khub krp",[]
After many years again in hall lan...  ,"[0, 0]"
"I found you carelessly, why will you be lost now? How can you say that I am alone, look back and I am standing.",[]
Jhagra Kaira Jitta Gayi with elder sister #feeling Mahanayak of third world war,[]
I'm hooked on vural fiber  and I'm getting a runny nose again  #fb,"[2, 3]"
"Fortunately, the two leaders did not have a face-to-face dialogue! ",[0]
Bhavtasi red phone 2 drama Banamu!  ,"[0, 3]"
