translated_text_no_emoji,emoji_labels
"Good writers often touch life, mediocre writers touch life, and bad writers touch life… http/fb.me/33kE4fmpQ",[3]
"Love is a great achievement in human life. No one gets love without asking, and no one gets love even after suffering a lot. ",[2]
"A lot of time is going away, I have to do everything myself. A single person's family.  - feeling lack of wife.",[2]
I'm scared ,[2]
I miss mom so much ,[2]
I'm fishing Feeling- Fish is smarter than me. Does not catch. ,[2]
Why do I do such stupid things sometimes …… #feeling helpless,[]
Manik has been arrested.  http/fb.me/3sC6LlyTV,"[2, 3]"
All the physical problems that Manna De suffered from were from my grandfather. Kidney and lung problems ,[2]
Manna Deo got fused this year ,[2]
I listened to the phone conversation of the Honorable Prime Minister and the Leader of the Opposition. How rude and quarrelsome people can be Khaleda Zia... http/fb.me/1XjnCczJs,[3]
There should be a limit to what people want!!!! ,[2]
Masha Allah! How many Muslims are online right now??  Give voice by liking. . . . http/fb.me/2vA36Ch7I,"[0, 3]"
miss u manna kaka ,[2]
"The point is that madam was busy applying make-up in anticipation of a video call, so she did not hear the phone ringing. Her loss was 37 minutes. ",[0]
Having fun...interviewing is fun  http/fb.me/2uCcSCkJ4,"[0, 3]"
I don't know why... ,[2]
Like if you enjoy it..  http/fb.me/6pJtuSWKO,"[0, 3]"
"Madam Khaleda, if you give a strike, you give it in a good way, if you don't give it, don't give it.",[]
Only middle class family people can see the true face of the world.  ,[2]
It seems like everything is over.......  but actually haven't started yet  #Shayal_Pandit's Quotes B |,"[3, 2]"
The execution of war criminals in the damadol of masnad and election is gradually sidelined ,[2]
I did not sleep anymore ... Feeling slapped to myself,[]
"Hot at night, cold in the day, the weather is extreme!!!!! ",[0]
Ancelotti happy having Ronaldo #HalaMadrid http/www.dboxb.com/ancelotti-happy-having-ronaldo/ …,[3]
Is Robi a mobile operator or a thief??? :-C After having MB he is making money !!! :O silly Ravi ,[2]
"For the first time in my life, I am making tea with my own hands! Liger red tea with a little sugar! A different experience!  ",[0]
"I heard Lal's telephone conversation completely, I can't understand Khaleda Zia must watch Hindi serial  Hasina to her... http/fb.me/2Vw8Rb8Yx","[0, 3]"
Red Phone Talk Misty Jhal Talk  https/soundcloud.com/yaseen-fida-hossain/khaleda-hasina-phone … http/fb.me/33mwIiWf7,"[0, 3]"
"A decoration of Brockwall Park, London. Flowers arranged on a bicycle! http/fb.me/2wTtbqbqh",[3]
"My mind became green, fresh and relaxed like the sweetness of a white winter morning. I m feeling heavenly happiness in my life .............",[]
"Did you hear my cry, mother, did you hear my cry today?   ",[2]
Happy Vijaya Dashmi with love and sincere congratulations..,[]
Good wishes Good Night!,[]
"Good morning Today, after many days, I walked barefoot on dewy grass Feeling Awesome ",[0]
Good night  I will sleep with peace now,[0]
I have to sleep early in the morning..I have to get up early in the morning..Mother's strict order ,[2]
Sa. .. La ] Looks like someone trapped me inside a vacuum ,"[2, 3]"
"Well done Sheikh Hasina, this is why it is said that if politics is in the blood, who will lose ",[0]
The truth!!   http/fb.me/2uowNtEL1,"[0, 0, 3]"
Nice story  http/fb.me/PFrMCKBQ,"[0, 3]"
good morning ,[0]
Everyone says that I am too late to reply!! Where?? ,[2]
Supporters like!! #RKB http/fb.me/2Bku0Ekyc,[3]
Time doesn't pass  When will that morning be? And when will we meet ,[2]
Good Morning Friend. http/fb.me/2viR5yGOv,[3]
Hasina you do not say anything!! Ma'am would break the phone. ,[0]
Hasina Khaleda do not live in the net! feeling___someone cut me with a plow Myrala....,[]
Laughing Shash  Official Drama Queen of Cricket  OKAD,[0]
"Laughing,  @sheikhriad1 Vs @dk_sadia",[0]
"Haha, lol hope Atit keeps up the series  http/fb.me/XaWJ5dLK","[0, 3]"
"Hahaha..... What do the bulls say... 60 hours strike from 27th. .. Oh crazy, that day is our exam...   ",[0]
HAHAHAHAHAHAHAHAHAHAHAHAHAHAHAHAHAHAHAHAHAHAHAHAHAHAHAHAHAHAHAHAHAHAHAHAHAHAHAHAHAHAHAHAHAHAHAHAHAHAHAHAHAHAHAHAHAHAHAHAHAHAHAHAHAHAHAHAHAHAHAHAHAHAHAHAHAHAHAHAHAHAHAHAHAHAHAHAHAHAHAHAHAHAHAHAHAHAHAHAHAHAHAHAHAHAHAHAHAHAHAHAHAHAHAHAHAHAHAHAHAHAHAHAHAHAHAHAHAHAHAHAHAHAHAHAHAHAHAHAHAHAHAHAHAHAHAHAHAHAHAHAHAHAHAHAHAHAHAHAHAHAHAHAHAHAHAHAHAHAHAHAHAHAHAHAHAHAHAHAHAHAHAHAHAHAHAHAHAHAHAHAHAHAHAHAHAHAHAHAHA,[]
"As many incidents of vandalism happen during the strike, why not sue Khaleda Zia as a defendant for the alleged incident? - show cause >",[2]
"Hooray!!! It's 12 o'clock! It's 12 o'clock! Hey, not me! At 12 o'clock on the 25th, it is now the 26th! ",[0]
