Text,translated_text
"@idevadhikari ( I-LOVE-U-DEV , ) forever n রংবাজ সুপারহিট রংবাজ সুপারহিট রংবাজ সুপারহিট 5
","@idevadhikari ( I-LOVE-U-DEV , ) forever n Rangbaaz Superhit Rangbaaz Superhit Rangbaaz Superhit 5"
"আম্মু-আব্বুর সাথে প্রায় দুইমাস পর একত্রিত হলাম :) এখন আরামসে গেম খেলি শুধু। খাওয়া দাওয়ার চিন্তা এখন আমার না, আম্মুর :)
","Reunited with mom and dad after about two months :) Now just play games comfortably. I don't care about food now, mom :)"
"কোপাকুপি জিনিষটা আসলেই মজার।নিজেকে খোকা বাবু মনে হচ্ছে…দামা , দা , বটি রকস ;)
","The grumpy thing is really funny. Feels like a kid… dama, da, botty rocks ;)"
":D :D :D নতুন এক কথায় প্রকাশ ... <3 ইট http://fb.me/25Ykw29g6 
",:D :D :D New one word expression... <3 It http://fb.me/25Ykw29g6
"শুভ জন্মদিন প্রিয় কবি রুদ্র মুহম্মদ শহিদুল্লাহ (Rudra Muhammad Shahidullah)
",Happy birthday dear poet Rudra Muhammad Shahidullah (Rudra Muhammad Shahidullah)
"ত্যাগের আনন্দে ভাস্বর পবিত্র ঈদুল আযহা: ঈদ মুবারক! http://dlvr.it/48JzSh 
",Holy Eid-ul-Azha in the joy of sacrifice: Eid Mubarak! http://dlvr.it/48JzSh
"প্রচন্ড ঝরে ছাদের বসে আছি, feeling দারুণ মজা!
","I'm sitting on the roof with heavy rain, feeling great fun!"
"@jeet30 ঈদ মুবারক & শুভ রাত্রি JeeT :-)
",@jeet30 Eid Mubarak & Good Night JeeT :-)
"@jeet30 [once again] ~শুভ বিজয়া দশমী~ আমার প্রণাম নিও। ভাল থেকো জিৎ :-))
",@jeet30 [once again] ~Happy Vijaya Dasami~ Take my bow. Stay well Jeet :-))
"জীবনে প্রথম Application বানাইলাম Windows Phone এর জন্য । খুব ভালো লাগতেছে Feeling Happy 󾌵
",I made the first application in my life for Windows Phone. Very good Feeling Happy 󾌵
"ইদ আমাদের জীবনে বয়ে আনুক অনাবিল আনন্দ এই প্রত্যাসায় সকল কে যানায় ঈদ মোবারক Verry happy EID MOBARAK
",May Eid bring endless joy in our lives. Eid Mubarak to all. Very happy EID MOBARAK.
"তুমি না থাকলে দুপুরটা এত মিষ্টি হত না! :D hats off to #Ghazi, d real Ghazi! feeling both proud n relieved! a~hhh! :D
","Without you, the afternoon would not be so sweet! :D hats off to #Ghazi, d real Ghazi! feeling both proud and relieved! a~hhh! :D"
"আমাদের বাসার পাশে এ পুকুর টা। এখানে মাছ ধরবো। তাই বশ্বি কিনেছি। feeling happy. http://fb.me/38uO3TrSv 
",This pond is next to our house. I will fish here. So I bought Bashi. feeling happy http://fb.me/38uO3TrSv
"আলহামদুলিল্লাহ্। নিরাপদে বাড়িতে পৌঁছাতে পেরেছি। অনেক কম সময়ে সুন্দর একটা ভ্রমণ। feeling happy together
",Alhamdulillah. I managed to reach home safely. A beautiful trip in a very short time. feeling happy together
"হা হা বেচারা ইনিয়েস্তা :D [[cristiano]] #C_RAJ_7 [[cristiano]] http://fb.me/19t6BvP8M 
",Ha ha poor Iniesta :D [[cristiano]] #C_RAJ_7 [[cristiano]] http://fb.me/19t6BvP8M
"একটা চরম হাসির বাংলা র্যাপ গান ডাউনলোড করলাম আজকে :)) কিঞ্চিত এডাল্ট টাইপের :v এইজন্য লিংকটা শেয়ার করব কিনা এই নিয়ে চিন্তায় আছি :v :v
",I downloaded a very funny bangla rap song today :)) It's a bit adult type :v So I'm wondering if I should share the link :v :v
"ঐশ্বরিয়া ও তার কিউট মেয়ে :) http://fb.me/1l1guV19D 
",Aishwarya and her cute daughter :) http://fb.me/1l1guV19D
"যাক না হারিয়ে যাক মিলিয়ে যাক সব আজ বাতাসে ভেঙে দেব সব বাধা আজ তোমার ই হাতটি ধরে... :)
","Let's not get lost, let's get together, today I will break all the obstacles in the wind, today I will hold your hand... :)"
"ABC Radio FM 89.2 ""আমাদের কথা"" :-) http://fb.me/1ZPCZUMcy 
","ABC Radio FM 89.2 ""Our Talk"" :-) http://fb.me/1ZPCZUMcy"
"বড় লিটিল ভাগ্নি আর ছোট লিটিল ভাগ্নি :) http://fb.me/2etCwcswM 
",Big Little Niece and Little Little Niece :) http://fb.me/2etCwcswM
"সৃজন মানে সৃষ্টি :)
",creation means creation :)
"এলানো <3 ২০১০ সালের বিশ্বকাপে ব্রাজিল দলের অন্যতম একজন খেলোয়াড় ছিলেন তিনি। বসকে মনে থাকলে লাইক দিন। #JIQU http://fb.me/2nQbhe4Hf 
",Elano <3 He was one of the players of the Brazil team in the 2010 World Cup. Like if you remember boss. #JIQU http://fb.me/2nQbhe4Hf
"অনেক দামী পাঞ্জাবি :P. থুক্কু, মূল্যবান পাঞ্... - http://pixb.ly/1ctyIsc 
","Very expensive Punjabi :P. Thukku, precious water... - http://pixb.ly/1ctyIsc"
"আমাদের ঘৃতকুমারী সেই একটা ফুল ফোটাইসে :D
",Our aloe plant is blooming :D
"একটা মেয়ে যখন একটা ছেলেকে I LOVE U বলে তখন ছেলেটা বলে I LOVE U TO| কিন্তু <3 | | | | | বাংলাদেশী একটা ছেলে যখন... http://fb.me/3bUH6IOPu 
","When a girl says I LOVE U to a boy, the boy says I LOVE U TO But <3 | | | | | When a Bangladeshi boy... http://fb.me/3bUH6IOPu"
"সর্বকালের সেরা লেফট ব্যাক স্যার রবার্টো কার্লোস <3 ফ্যানস ২০০+ লাইক চাই #RKB http://fb.me/6uoC2NYse 
",Best left back ever Sir Roberto Carlos <3 FANS 200+ LIKES #RKB http://fb.me/6uoC2NYse
"রাসুল (সা:) এর বিলাসিতা !!! উমর (রা:) থেকে বর্ণিত, তিনি বলেন, আমি রাসূলুল্লাহ সাল্লাল্লাহু আলাইহি ওয়াসাল্লাম এর... http://fb.me/6IOMfRF5A 
","The luxury of the Prophet (PBUH)!!! On the authority of Umar (ra), he said, I am the Messenger of Allah, may God's prayers and peace be upon him... http://fb.me/6IOMfRF5A"
"@FalguniKlara ফাল্গুনী আপু তোমার বায়োটা চরম হইছে ... :D
",@FalguniKlara Falguni Apu your bio is extreme... :D
"উদ্দেশ্য ভাল, ইচ্ছা ভাল ..... কংগ্ৰেছ ৰ বখলিয়ালে চাল , নেতা হিচাবেও মানুহজন ভাল :-) #মোডী #দেওবৰীয়াকন্ফিউজন #কিবাহয়পিছলৈ :P
","The intention is good, the desire is good.....Congress's bakhliale rice, leaders are good too :-) #मोडी #देवब॰याकंफुज़ोजन #कीबाहोयपिच़लोई :P"
"বাংলা অপটিক্যাল ক্যারেক্টার রিডার :D... http://fb.me/2a6hLn5At 
",Bangla Optical Character Reader :D... http://fb.me/2a6hLn5At
"''ভালোবাসার মাঝে হালকা ভয় থাকলে, সেই ভালোবাসা মধূর হয়.. কেননা, হারানোর ভয়ে .. প্রিয়য়জনের প্রতি ভালোবাসা আরো বেড়ে যায় ''!♥!
","""If there is a slight fear in love, that love is sweet.. because, fear of loss.. love for the loved one increases""!♥!"
"গত রাতে ডাচ ক্লাব ভিতেসের হয়ে ১ টি গোল & ২ টি অ্যাসিস্ট করে দল জিতিয়েছেন লুকাস পিয়াজন :-) লাইক হবে ?? #RKB http://fb.me/14PFSZaRh 
",Last night Lucas Piazon scored 1 goal & 2 assists for Dutch club Vitesse and won the team :-) Like ?? #RKB http://fb.me/14PFSZaRh
"গাছের ডাল দিয়ে কুড়ালের হাতল বানিয়ে সেই কুড়াল দিয়ে মানুষ সেই গাছই কাটে। মানুষ বড় অকৃতজ্ঞ প্রাণী।:-)
","By making an ax handle from a tree branch, people cut that tree with that ax. Humans are big ungrateful creatures. :-)"
"ব্যাচেলর ডিগ্রী কমপ্লিট করা ছাড়া ব্যাচেলর ডিগ্রী হারাব না। :) :D আপনার প্লান কী?
",A bachelor's degree will not be lost without completing the bachelor's degree. :) :D What's your plan?
"ভাইয়া তার কোন ফ্রেন্ড এর বাসায় যাচ্ছে গ্রুপ স্টাডি করতে .. আম্মু বলে '' সত্তি করে বল তো কোন মেয়ের সাথে দেখা করতে যাচ্ছ ?'' xD :D
","Brother is going to his friend's house for group study.. Mom says ""Satike tell me which girl are you going to meet?"" xD :D"
"ভালবাসা কি খেলনা? -_- ইচ্ছা হল খেললাম,ইচ্ছা হল ভেঙে দিলাম? :v :p অনেকেই বলতে শুনি ওর সাথে ব্রেক-আপ করে ফেলব... http://fb.me/6nqOlzx35 
","Is love a toy? -_- I wish I played, I wish I broke it? :v :p I heard many people say that I will break up with her... http://fb.me/6nqOlzx35"
"পথ শিশুদের নিয়ে এই ভদ্রলোক দামী ফাস্ট ফুডে ঢুকে গেলেন সবাই মিলে খাবার জন্য ...... স্যালুট <3 http://fb.me/17jSgQwYQ 
",This gentleman with street children went into expensive fast food to eat all together ...... Salute <3 http://fb.me/17jSgQwYQ
"camera এর সাথে একটু দুষ্টুমি :p :p :p http://fb.me/2zu15KGjG 
",A little mischief with the camera :p :p :p http://fb.me/2zu15KGjG
"আমার জানা শোনা মতে বেস্ট পিকেটিং হইসে এটা :D http://fb.me/1OazV9019 
",This is the best picketing I know :D http://fb.me/1OazV9019
"একটি নাইকন ১৮-৫৫ মিমি লেন্স বিক্রয় হইবে। আগ্রহী রা Fayek Tasneem Khan এর সাথে যোগাযোগ করুন :D http://fb.me/2KMTT9gKv 
",A Nikon 18-55mm lens for sale. Interested contact Fayek Tasneem Khan :D http://fb.me/2KMTT9gKv
"Sunnah... it's not a choice! It's a Must! <3 ••► সাহাবাগন সে সমস্ত কাজ গভীর আবেগ আর ভালোবাসা নিয়ে করেতেন যা কিছু... http://fb.me/1cnhaPJ2c 
",Sunnah... it's not a choice! It's a must! <3 ••► Sahabagan used to do all those things with deep passion and love whatever... http://fb.me/1cnhaPJ2c
"how FunNny ?? :P তরুন প্রজন্মের নেতা শাহবাগ গনজাগরণ মঞ্চের আহবায়ক বাংলাদেশের (২য় মুক্তিযুদ্ধের) ঘোষক জনাব ইমরান... http://fb.me/AH6Zdb2P 
",how FunNnny?? :P Youth generation leader Shahbag Ganjagaran Manch convener Bangladesh (2nd liberation war) announcer Mr. Imran... http://fb.me/AH6Zdb2P
"Quote of the Day :) একজন লেখক হলেন সেই ব্যক্তি, যাঁর জন্য লেখালেখি অন্যদের চেয়ে কঠিন। .....টমাস মান (জার্মান ঔপন্যাসিক)
",Quote of the Day :) A writer is someone for whom writing is more difficult than others. .....Thomas Mann (German novelist)
"জোশ! :D http://fb.me/20LTFvmBj 
",Josh! :D http://fb.me/20LTFvmBj
"ম্যাক্সিমাম ডিরেক্টররা শুটিং স্পটে দেরী করে আসে, আইসা আবার অ্যাসিস্ট্যান্টদের ঘাড়ায় :P
","Maximum director comes late to shooting spot, Aisa calls assistants again :P"
"সুপ্রভাত সবাইকে… :-) :-)
",Good morning everyone… :-) :-)
"What's the best thing that happened to you today? — Rebirth of Sound box এতদিন যাতনা চাপিয়া যন্ত্রণায় ছিলাম :P http://ask.fm/a/a0qohh96 
",What's the best thing that happened to you today? — Rebirth of Sound box I was in pain after pressing for so long :P http://ask.fm/a/a0qohh96
"বল বীর, বল চির উন্নত মম শির, শির নেহারি নত শির ওই শিখর হিমাদ্রির. - কবি কাজী নজরুল ইসলাম #SRK_JAN <3
","Say hero, say ever-elevated mom Shir, Shir Nehari nat Shir that peak of Himadri. - Poet Kazi Nazrul Islam #SRK_JAN <3"
"হুমায়ূন স্যারের বইয়ের সাথে আপনাদের ১ম পরিচয়ের গল্পটি আমাদের শেয়ার করুন :) চাইলে পেজে মেসেজও করতে পারেন ! :)
","Share with us the story of your first acquaintance with Humayun Sir's book :) If you want, you can also message the page! :)"
"#হিমু ভালবাসার সর্বকালীন শ্রেষ্ট কথা !! | | | | | | | | | | | জানু তুমি ভাত খাইছো ? :p :p
",#himu best love quotes ever !! | | | | | | | | | | | Do you know you are eating rice? :p :p
"আজ রোজা রেখেছেন কে কে?? :)
",Who is fasting today?? :)
"গরম ভাত সাথে গরুর মাংস ভুনা।। আআআহ তার পরে আবার বউ মুখে তুলে দিছে খাওয়ায়ে ।। এর থেকে ভাল সকাল আর কি বা হতে পারে?? শুভ সকাল বন্ধুরা :)
","Roast beef with hot rice. After that, the wife again put food in her mouth. What could be a better morning than this?? good morning friends :)"
":) শুভ সকাল :) http://fb.me/TtMbGVa3 
",:) Good Morning :) http://fb.me/TtMbGVa3
"দুষ্ট গরুর চেয়ে শূন্য গোয়াল ভালো !!!! এখন গোয়াল ঘরের পরিস্কার কাজ চলছে। :P :P
",Zero cows are better than evil cows !!!! Now the cow house is being cleaned. :P :P
"গুড জব রবি। এইরখম ফ্রি আর কয়েক দিন রাখিস :)
",Good job Ravi. Keep it free for a few more days :)
"Like Our Jokes Page :p ---------------------------- •৷• হাসির ঔষধ - খাইলেই বুঝবেন •৷•... http://fb.me/PJWNU85L 
",Like Our Jokes Page :p --------------------------- •.• Medicine of laughter - you will understand if you eat it •.•... http: //fb.me/PJWNU85L
"আজ ৮ই ডিসেম্বর কুমিল্লা মুক্ত দিবস । ১৯৭১ সালের এই দিনে পাক হায়েনা মুক্ত হয় আমাদের কুমিল্লা :)
","Today 8th December is Comilla Independence Day. On this day in 1971, Pak Hyena was freed from our Comilla :)"
"ক্যারে...পেইজে লাইক দেস না ক্যারে ? ॥॥ সিকান্দার বক্স এখন ফেইজবুকে ॥। <3 সিকান্দার বক্স <3 <3 সিকান্দার... http://fb.me/3iraJa3VJ 
",Why do you not like the page? ॥ Sikandar Box is now on Facebook. <3 Sikandar Box <3 <3 Sikandar... http://fb.me/3iraJa3VJ
"অবো-তাল :v পসন্দ হৈসে! একটা ফিউশন ফিউশন ভাব আছে! :P http://fb.me/6PwHQEGn7 
",Abo-tal :v Pasand Haise! There is a fusion fusion feeling! :P http://fb.me/6PwHQEGn7
"শুভ সকাল বন্ধুরা !!! সুন্দর হোক তোমার আজকের দিনটা..... :)
",Good morning guys!!! Have a nice day.....:)
"শীত শীত শীতেল হাওয়া 3:) তোর কি সাধ্য আমায় ছোঁয়া 8-) ভালবাসি চাদরের কোমল আদরে :3 রেখেছি ঘিরে এই আমাই :v শীত শীত শীতেল হাওয়া :)
",Cold cold cold wind 3:) What can you do to touch me 8-) Love the soft caress of the sheet :3 I keep this around me :v Cold cold cold wind :)
"মতিকন্ঠ সমাচার :) http://fb.me/3dGlXQMFg 
",Matikantha Samachar :) http://fb.me/3dGlXQMFg
"চা ইজ দা পাওয়ার অফ আওয়ার এনারজি :P http://fb.me/2dk8HkuB3 
",Tea is the power of our energy :P http://fb.me/2dk8HkuB3
"পরীক্ষার আগের ১৫ দিন শত চেষ্টা করেও ৯ টার আগে ঘুম থেকে উঠতে পারি নি। নিয়তির কি পরিহাস ! এখন ৮ টার সময় উঠে ফেবু তে বসি :P
","15 days before the exam, I could not wake up before 9 o'clock despite my best efforts. What irony of destiny! Now I get up at 8 o'clock and sit on Facebook :P"
"গভীর রাতের মাংস পোড়া স্ট্যাটাসে স্ট্যাটাস ফেসবুক একদম কাবাবময় :D বিধাতা তুমি কচি পোলাপাইনের এই শোক সইবার শক্তি দাও আমীন
","Late night meat burning status status Facebook is absolutely kebab :D God give you the strength to bear this grief of little Polapine, Ameen."
"খিলগাঁও টু উত্তরা এইয়ারপোর্ট এর শেষ সীমানা :D অস্থির একটা সাইকেল রাইড করলাম :D ৯ ঘণ্টা সাইকেল চালাইয়া এখন পা... http://fb.me/34dgVKvaQ 
",Last border of Khilgaon to Uttara Airport :D I had a restless bike ride :D After 9 hours of cycling now... http://fb.me/34dgVKvaQ
"দেওবৰীয়া সুপ্ৰভাত ৰাইজ :-)
",Good Morning Deobariya :-)
"গুড মর্নিং :)
",good morning :)
"সুন্দর একটি নাস্তার জইন্য আমার ছোটভাই Mehedee Hasanকে ধনেপাতার শুভেচ্ছা... :D
",Best wishes for a beautiful breakfast jainya to my little brother Mehedee Hasan... :D
"ঘুমিয়ে না পড়লে রাসুল (সঃ) একটি বানী শুনে ঘুমান...!!! আয়েশা (রা:) থেকে বর্ণিত, “রাসুল (সাঃ) প্রতি রাতে শয্যা... http://fb.me/WmFajUKh 
","If you do not sleep, Rasool (SAW) listens to a speech and sleeps...!!! Narrated Aisha (RA): “The Messenger (PBUH) used to sleep every night... http://fb.me/WmFajUKh"
"আমি তোমার জন্য জমিয়ে রাখা ভালোবাসা উড়িয়ে দিয়েছি কোন নামহীন কবিতার মাঝে। :p pic.twitter.com/e8cQpvY7D8
",I blew the love I kept for you in some nameless poem. :p pic.twitter.com/e8cQpvY7D8
"এরশাদ সাহেব চমৎকার ভাবে কথা বলেন... :p... http://fb.me/326wPTxSe 
",Ershad sahib speaks beautifully... :p... http://fb.me/326wPTxSe
"ফাটাফাট (ভারতীয়দের মতোন আর কি) কয়েকটা টোস্ট আর এক মগ দুদ চা মেরে দিলাম... এট্টু ভাল্লাগচে যে ঠাকুরপো! :)
",Fatapat (what else like Indians) I killed a few toasts and a mug of dud tea... Ettu Vallagche that Thakurpo! :)
"গুড মর্নিং টুইটিয :-)
",Good Morning Tweets :-)
"ধনীর ঘরের সন্তানেরা বড় হতে সময় লাগে ৩০ বছর। আর গরিবের সন্তানেরা বড় হয় ১০ বছরে। হাজারো শুকরিয়া ধনীর দুলালদের চেয়ে ২০ বছর এগিয়ে আছি :p
","It takes 30 years for the children of a rich family to grow up. And the children of the poor grow up in 10 years. Thanks a lot, I am 20 years ahead of Dhani's brokers :p"
"কেও আমারে মাইরালা...... :D http://fb.me/1vtnDLBtA 
",Keo Amare Myraala...... :D http://fb.me/1vtnDLBtA
"আমি বাংলাদেশি।I love my country.★★★
",I am Bangladeshi. I love my country
"অনেক মানুষই ভাবে যে পৃথিবীর সবচেয়ে সুন্দর কথা হলো *I LOVE YOU* . কিন্তু এর চেয়েও প্রিয় বাক্য হলো যখন কেউ... http://fb.me/2fsg1Lb1L 
",Many people think that the most beautiful words in the world are *I LOVE YOU*. But even more favorite saying is when someone... http://fb.me/2fsg1Lb1L
"I Love Bangladesh এর পক্ষ থেকে কুমিল্লাবাসীকে জানাই আন্তরিক অভিন্দন..... http://fb.me/1a7uPuhUb 
",Heartiest congratulations to the people of Comilla from I Love Bangladesh..... http://fb.me/1a7uPuhUb
"মা ভক্তদের জন্য অসাধারন একটি পেজ I Love My Maa লাইক দিতে ভুলবেন না
","Don't forget to like I Love My Maa, an awesome page for Maa fans"
"যদি ভালো লাগে তাহলে ঘুরে আসুন এই পেজটায় । SWEET Love SWEET Love SWEET Love
","If you like it, visit this page. SWEET LOVE SWEET LOVE SWEET LOVE"
"LOVE THIS ........ তুমি রবে নীরবে হৃদয়ে মম নিবিড় নিভৃত পূর্ণিমানিশীথিনী-সম॥ মম জীবন যৌবন মম অখিল... http://fb.me/6jkA3yE1M 
",LOVE THIS ........ You are silent in the heart of the heart. Mom life youth mom Akhil... http://fb.me/6jkA3yE1M
"আমি ইংলিশ এ কাঁচা, তবুও এ টুকু বলতে পারি I LOVE YOU. আমি ভূগোল এ কাঁচা, কিন্তু বলতে পারবো আমার অন্তরে কোথায়... http://fb.me/PNO6sLV4 
","I am raw in English, but I can say I LOVE YOU. I'm raw in geography, but can tell where my heart is... http://fb.me/PNO6sLV4"
"ভালোবাসা দিতে কি special মানুষ লাগে… সবাই- সবাইরে দিলে কি হয়, ভালোবাসা বিলাইলে তো আর ফুরায় যায়না... I Love you all ..
","Does it take a special person to give love... What happens if you give it to everyone, love never ends... I love you all.."
"love Jamdani and Tangail Taater Saree শান্তিনিকেতনে ঢাকাই জামদানী আর মসলিন প্রকাশ তারিখ: ০৬/১২/২০১৩ ১২:০৬:৫৭... http://fb.me/LnBhUEb6 
",love Jamdani and Tangail Taater Saree Shantiniketan Dhakai Jamdani and Muslin Published Date: 06/12/2013 12:06:57... http://fb.me/LnBhUEb6
"sondor sundor jocks and love story pete akhon a ai page a like din.... তুমি শুধু আমার তুমি শুধু আমার তুমি শুধু... http://fb.me/2ukaH6RoK 
",sondor sundor jocks and love story pete akhon a ai page a like din.... you only mine you only mine you only... http://fb.me/2ukaH6RoK
"আমার নতুন এঞ্জেলফিস গুলো অতিমাত্রায় লাজুক। আমি কাছে আসলেই জারের গাছের নিচে পালায়। Love these little #Angels...
",My new angelfish are extremely shy. I actually ran under the jar tree. Love these little #Angels...
"তুমি আমার ঘুড়ি ... আমার হাতে নাটাই... যেখানেই উড়ে বেড়াও ... আমার আকাশ পুরটাই... Love u .... Miss u so much.....
",You are my kite... fly in my hand... fly wherever... my sky is full... Love u .... Miss u so much.....
