Text,translated_text
"হাসতে পারিনা কাঁদতেও পারিনা-বাঁচতে চাইনা মরতেও পারিনা- :(									
","I can't laugh, I can't cry - I don't want to live, I can't die - :("
"না পারলোনা রাতের ঘুম আমাকে হারাতে পারলো না কিন্তু সকালের ঘুম আমাকে ঠিকই হারতে বাধ্য করবে :(									
",No sleep at night can't lose me but morning sleep will make me lose it right :(
"একদিন তুমি বলেছিলে আমি এখন আর একা নই তুমি আমার সাথে আছো !! কিন্তু আজ তুমি নেই তোমার দেয়া কষ্টগুলো আমার সাথে আছে ... :(									
","One day you said I am not alone anymore you are with me !! But today you are not there, your troubles are with me... :("
"খুব পেইন এ আছি:-(:-(									
",I am in so much pain :-(:-(
"ছুটি দুই'টা বৃথাই গেলো :(									
",Both vacations went in vain :(
"সারাদিন বৃষ্টিতে ভিজে এখন অবস্থা সেইরাম ফিলিং মাথা ব্যাথা...:(									
",Wet in the rain all day and now the situation is like a filling headache...:(
"তোরা যে যা বলিস ভাই...আমার সোনার হরিণ চাই... আলাদীনের চেরাগ হলেও মন্দ হয় না... কারণ আমার পার্সে এখন দুর্ভিক্ষ চলছে :/ :(									
",Whatever you say bro...I want a golden deer...Aladdin's lamp is not bad...because my purse is starving now :/ :(
"আমরা কিছু কইলেই দোষ! :-( :-( :-(									
",We are guilty of anything! :-( :-( :-(
"জ্বর এ অবস্থা খারাপ :( :(									
",Fever is bad :( :(
"মনটা ভীষণ খারাপ :(									
",So sad :(
"যা হতে যাচ্ছে :( বহাবহ চিন্তা করা যায় না http://fb.me/M2nf9NVX 									
",What's going to happen :( can't think about it http://fb.me/M2nf9NVX
"ঢাকা জাওয়ার তারিখ পরিবর্তন করলাম, কিছু সমস্যা রয়েই গেছে, সমাধান না করে গিয়েও লাভ নেই :(									
","I changed the date of my visit to Dhaka, there are still some problems, there is no use without solving them :("
"কিউবি রে একটা শ্রেষ্ঠ ধোলায় দেবার দরকার ! স্লো নেট :(									
",QB Ray needs to be given a better wash! Slow Net :(
"কিং লিওর জাদুকরী ক্রস কিন্তু পিকের সহজ সুযোগ মিস :( ১৫ মিনিট শেষ - কোন দল গোল এর দেখা পাইনি ।									
",Magical cross from King Leo but Pique misses an easy chance :( 15 minutes to go - no team in sight of goal.
"উফফ!অল্পের জন্য গোল হল না।ইশ পিকে যদি হেডটা লাগাতো পারতো! :(									
","Oof! For a short time, the goal was not. :("
"৩ দিন ধরে জ্বর-ঠান্ডা-কাশি লেগে আছে. অবস্থা খুবই খরাপ .. :(									
",Fever-cold-cough for 3 days. The situation is very bad.. :(
"ইচ্ছে থাকলেই উপায় হয় না।। এই রকম সুড়সুড়ি মার্কা ঘুমের পরিবেশ রেখে স্যারের সাথে মিটিং !!! :-(									
","If you want, there is no way. Meeting with Sir keeping such a ticklish sleeping environment !!! :-("
"ভুইলাই গেসি আজকে হরতাল!!.:( ক্রিকেট খালা ছিল সকালে :/									
",Bhuilai Gesi strike today!!.:( Cricket aunty was in the morning :/
"কিচ্ছু কিচ্ছু সময় তোমাকে অনেক বেশি miss করি.... :(									
",Sometimes I miss you a lot... :(
"ঠ্যাং চেগাইয়া নবাবী ঘুম দিছিলাম :/ আফসুস আমার ঘুম কারো সহ্য হয় না :(									
","I gave a good night's sleep by banging my bangs :/ Sorry, no one can tolerate my sleep :("
"আগের লিখা সবকিছু মুছে ফেলেছি... নতুন কিছু লিখবো এই ভেবেই বসি খাতা-কলম নিয়ে কিন্তু তুমি ছাড়া আমার লিখার মতও কিছু নাই :(									
",I have deleted all the previous writing... I sat down with notebook and pen thinking to write something new but without you I have nothing to write :(
"হৃত্তিক হইবার মন চায় :(									
",I want to be heartbroken :(
"ছোট্ট বেলায় অভিমান করলে অনেক কিছু পেতাম, আর এখন অভিমান করলে অনেক কিছু হারাই.. !! :-(									
","When I was young, I got a lot of pride, but now I lose a lot of things..!! :-("
"মাইরালামু >:(									
",myralamu >:(
"আমার সব চেয়ে গুরুত্ব পূর্ণ ইমেইল আইডি টি হ্যাঁক !! ফেসবুক আইডি ও হ্যাঁক :(									
",My most important email id is hank !! Facebook ID and Hank :(
"নাই নাই, কেউ নাই.. :(									
",No no no one.. :(
"কিছুতে তোমার মনটা আমি বুঝতে পারিনা,এতো চেনা তবু কেন লাগে অচেনা? :(									
","I don't understand your mind about something, why does it feel so familiar yet unknown? :("
"একদিন কান্নার রোল উঠবে আমার বাড়িতে, আমায় নতুন করে দেখতে সবাই আসবে সারি সারিতে . . . :( :( :(									
","One day there will be tears in my house, everyone will come in rows to see me again. . . :( :( :("
"সমস্যা এর সমাধান জানতে চাই :( http://techtun.es/1aKi1ap 									
",Want to know the solution to the problem :( http://techtun.es/1aKi1ap
"আজ ইন্টারনেট এর মেয়াদ শেষ :( আবার ১২০৮ টাকা পে করতে হবে :( ভাবলাম যে টাকা পয়সার সমস্যা , অল্প টাকায় ক্যাবল... http://fb.me/12LwMb2bJ 									
","Internet expired today :( I have to pay Tk 128 again :( I thought that money is a problem, cable for a small amount... http://fb.me/12LwMb2bJ"
"সত্যি,,,,জীবনটা অন্যরকম হতে পারতো :(									
","Really,,,,life could have been different :("
"পালিয়ে যাইতে চাই :'( অনেক দূর :(									
",I want to run away :'( far away :(
"গোফ দাড়ির জলাঞ্জলী দিলাম। ফিলিং - বিমর্ষ :(									
",I gave Goff beard water. Filling - Vimarsh :(
"এত বৃষ্টি হচ্ছে তাও গরম কাটেনা :(									
",It's raining so much it's not hot :(
"প্রয়োজনে সময় কেউরে পাওয়া যায় না >:(									
",Can't find the time needed >:(
"পরীক্ষার জন্য প্রায় ১ মাসের জন্য ফেসবুক কে বিদায়, সবাইকে খুব মিস করব। বাট মাঝে মাঝে মোবাইলে আসা হবে :(									
","Goodbye to Facebook for about 1 month for exams, will miss you all very much. But sometimes it will come to mobile :("
"ছুটির মধ্যে হরতাল এর বন্ধ পাওয়া মানে ""তেলা মাথায় তেল দেয়া!"" — feeling bored -_-									
","Stopping the strike during the holidays means ""oil on the head!"" — feeling bored -_-"
"কেন যে আমার সাথে এমন হয় বুঝি না। আল্লাহ আমাকে কোন রকম পাশ করিয়ে দাও আমি যেন next semester এ উঠতে পারি:( :(:(:(:(:(:(									
",I don't understand why this is happening to me. May Allah give me any kind of pass so that I can appear in next semester :( :(:(:(:(:(:(
"এইডা আমারে কি জরে ধরিল !!!! সকালে আছে বিকেলে নাই আবার সন্ধ্যায় আছে রাত্রে নাই !!!!! জরের এই লীলাখেলার মাঝে পইরা আমি শেষ :-( :-(									
",This is what caught me !!!! In the morning there is no in the afternoon and in the evening there is no in the night!!!!! I'm the last one to fall in the middle of this prank :-( :-(
"আমার বুকের মধ্যে চিন চিন ব্যাথা, কেউ তো একবার সুধায় না :( বুকের ব্যাথা বুকে নিয়ে তাই তো আমি যাইবগা									
","I have a pain in my chest, no one can solve it :("
"বালের ম্যাচ সব!! >_< ভিজে গেলে আর জ্বলে না!! >:( ভরসা ম্যাচ!!আই মিস ইউ!! :( :'(									
",Ball matches all!! >_< No more burning when wet!! >:( Hope match!! I miss you!! :( :'(
"কেন এই একাকি জীবন আমার? এর রহস্য আজ বুঝতে পারি:(( আর সেটা হল পৃথিবীতে একা আসা আর একা চলে যাওয়া।									
",Why is this my lonely life? I can understand its secret today :(( And that is to come alone to the world and leave alone.
"জীবন টা কেন জানি সাদাকালো মনে হচ্ছে :(									
",I know why life seems black and white :(
"বাকশক্তি হারিয়ে মোবাইল আমার বোবা !! :( সিম পরিবর্তন নিয়ে ব্যাপক সমোলচনার ভিড়ে পুরনো সিমে ফিরতেই হচ্ছে !! হ্যাঁ... http://fb.me/KUncUUIo 									
","My speechless mobile phone is dumb!! :( Due to the huge discussion about SIM change, I have to go back to the old SIM!! Yes... http://fb.me/KUncUUIo"
"কার্টুন দেখতেছিলাম :( ধুর কারেন্ট চলে গেছে :'( http://fb.me/2SkFux36n 									
",Was watching cartoons :( damn current gone :'( http://fb.me/2SkFux36n
"চিপায় আইটকা পড়সি। লাইফ হেল। :(									
",Read it on the chip. Life is hell. :(
"ইশ এখনকার মত যদি পরীক্ষার আগে পড়তাম....... নিশ্চিদ পাশ করতাম :( #fellings - বিলিয়ান্ট .. পুরা বই ই গরুর রচনার মত পড়তাছি									
",Ish like now if I had read before exam.......I would have passed for sure :( #fellings - Billiant .. I am reading the whole book like a cow's essay.
"সাবটুইট দেখি নাই রে ভাই :-(									
",I didn't see the subtweet bro :-(
"এখনও সফলতার মুখ দেখলো না আমার গোপন প্রজেক্ট টা :(( যাই হৌক,শেষ পর্যন্ত অপেক্ষা করবো।এখনও আশাহত হই নি।									
","My secret project has not seen success yet :(( Anyway, I will wait until the end. I am not disappointed yet."
"মোবাইল থেকে সফটয়্যারের ক্র্যাক নামানো চরম বিরক্তাকর। Feeling Boared . . .									
",Downloading cracked software from mobile is extremely annoying. Feeling Bored. . .
"সারাদিন রোমে থেকে ঘুমও হল না কোন ভালো কাজও হল না :(									
",I haven't slept in Rome all day and haven't done any good work :(
"Ahana সারাদিনে তোর সাথে একবারও কথা হয় নাই দোস্ত..!! মিস ইউ.....:(									
",Ahana I haven't talked to you even once all day friend..!! miss u.....:(
"দুচোখে তোমারই ছবি এঁকে যাই স্বপ্ন ভেবে সুখে তোমাকে হারাই :-( আমায় ভুলে সুখে থাকোই যত একদিন তুমিও ঠিকই কাঁদবে !									
",Let's paint a picture of you with both eyes and dream of losing you happily :(
"একটু আগে বাথরুমে গিয়ে দেখি একটা চেলা! ধুর... গা পুরো ঘিন ঘিন করছে। অসহনীয়। সরীসৃপ কে ঘৃণা করি :(									
",A little while ago I went to the bathroom and saw a chela! Damn... Ga is full of disgust. intolerable I hate reptiles :(
"কারো মেসেজ এর রিপ্লাই দিতে পারতেছি না :( উইন্ডোস আবার গেছে :( সেটআপ দিইতে গেলাম :( Asif Uddin Khalifa Faisal Mahmud Mahedi									
",Couldn't reply to someone's message :( Windows went again :( I went to setup :( Asif Uddin Khalifa Faisal Mahmud Mahedi
"অপেক্ষার মতন কষ্টের জিনিস আর নাই :| :| :( :( :'( :'(									
",There is nothing more painful than waiting : | :( :( :'( :'(
"বোঝেনা সে বোঝেনা . . . :-(									
",He does not understand. . . :-(
"একবারো কি আমাকে মেসেজ দেওয়া যায়না ? :( :'(									
",Can't you give me a message? :( :'(
"প্লীজ হেল্প :( http://fb.me/Xb1QfZ3u 									
",Please help :( http://fb.me/Xb1QfZ3u
"কিছুই ভাল লাগতাছে না .............. :(									
",Nothing looks good............ :(
"বিশিষ্ট সব কুত্তা চারিদিকে >:( http://fb.me/3aiavwzYy 									
",Featured dogs all around >:( http://fb.me/3aiavwzYy
"এইভাবে আর না :-(									
",Not like this anymore :-(
"রাতজাগা পাখি ও হয়তো ঘুমিয়ে পড়েছে আর আমার থেকে ঘুম পালিয়ে বেড়াচ্ছে...... :(									
",The night bird may have fallen asleep and sleep is running away from me...... :(
"মোর বন্দুয়া বিহনে গো :( সহেনা ফরানে গো 󾬎 একেলা ঘরেতে রইতে না ফারি :( 󾌹 - 󾇌 󾭝 󾭝									
",Mor Bandua Bihne Go :( Sahena Farane Go 󾬎 Ekala Gharete Roite Fari :( 󾌹 - 󾇌 󾭝 󾭝
"আম্মু আমার হরতালটা কোথায় রেখেছো? খুঁজে পাচ্ছিনা কেন? :-(									
","Mom, where did you put my hartal? Can't find why? :-("
"সে যে কেন আসে না কিছু ভাল লাগে না .... :( -- কারেন্ট এর কথা বলতেছি !!!									
",I don't like why he doesn't come... :( -- I am talking about current!!!
"কেঁচো দেখলেই আমার গা ঘিনঘিন করে উঠে.... অথচ কাল এটা ব্যবচ্ছেদ করব এটা ভাবতেই কেমন লাগছে :(									
",The sight of an earthworm makes me cringe.
"আর পারিনা আর পারিনা আমার ভীষন ক্লান্তি লাগে, আর জমেনা আর জমেনা রংগিন স্বপ্ন মনের কোণে :(									
","I can't and I can't, I feel tired, and colorful dreams don't accumulate in the corner of my mind :("
"একটা মশারির প্রয়োজন অনুভব করছি :(									
",Feeling the need for a mosquito net :(
"আবারও তুমিহীন....আমি যে ছন্দহীন :-(									
",Without you again....I'm hopeless :-(
"আমার প্রিয় মোবাইলটা গেলরে! :-( আর নিয়মিত বাংলায় পোষ্ট দিতে পারবোনা! ফেসবুকও নিয়মিত চালাতে পারবোনা! :-(									
",My favorite cell phone! :-( I can't post regularly in Bengali anymore! I can't even run Facebook regularly! :-(
"বড় কষ্টে আছি...:( সকাল থেকেই বাসায় পানি নাই... পানির মটর নষ্ট, টাংকিতেও পানি নাই...									
","I am in great trouble... :( There is no water at home since morning... The water tank is broken, there is no water in the tank either..."
"দিন ভর ফেইসবুক আর টুইটার আর ভালো লাগেনারে পাগলা.:(									
",It's crazy not to like facebook and twitter all day. :(
"আজ আমি ভাল নই Today I am not happy......									
",Today I am not happy Today I am not happy......
"খুব খারাপ লাগলো man city ও man utd দুই দল ই হারলো									
",It felt very bad that Man City and Man Utd both teams lost
"আর পারছিনা গুরু সেই নার্সারী থেকে শুরু :( http://fb.me/2jnS3dX0Q 									
",And I can't even start from that nursery :( http://fb.me/2jnS3dX0Q
"@idevadhikari একটা কথা জানেন...আপনাকে টুইট করা আর একটা গাছকে টুইট করা এক কথা! দেখেন ও না,রিপ্লাই ও করেন না! তবুও যে কেনো করি! :(									
","@idevadhikari knows one thing...tweeting you and tweeting a tree is one thing! Do not see, do not reply! But why do that! :("
"বৃষ্টি পরের কিন্তু আই ভিজির ন পারির :(((									
",Next rain but I can't see :(((
"হুরর আজকে ঘরে কিচ্ছু নাই...... KitKat খেয়ে একটু ক্ষুধা কমাইতে চাইলাম কিন্তু উল্টা ক্ষুধা আরও বেশি লাইগা গেল >:(									
","Hurray, there is nothing in the house today... I tried to reduce my hunger by eating KitKat, but on the contrary, my hunger got worse >:("
"শিট!!! ফেসবুকে ঢুকলে ৫ সেকেন্ডের ভিডিও এড দেখতে হবে !!! :(									
","Shit!!! If you enter Facebook, you will see a 5 second video ad!!! :("
"কিছু সংখ্যক নিদিষ্ট মানুষ (নারী জাতি) ছাড়া নারী জাতির প্রতি ঘৃনা আরো একধাপ বেড়ে গেল! :(									
","Apart from a few specific people (female caste), the hatred towards the women race increased one more step! :("
"ফেবুটা আবার ডিএক্টিভেট করবো ভাবছি। ভার্চুয়াল আর ভালো লাগেনা। কেন? জানিনা :(									
",I'm thinking of deactivating Facebook again. I don't like virtual anymore. Why? don't know :(
"স্বপ্ন ভাঙ্গার শব্দ বিকট হয় :( :( :(									
",The sound of breaking dreams is loud :( :( :(
"খুব বেশি খারাপ লাগতেসে #শৈলজ কে বিদায় জানাইতে :(									
",So sad to say goodbye to #Shailaj :(
"বন্ধুরা সব Graduate হইয়া যাইতাছে। আর আমি ইন্টার পাশ ই থাইকা গেলাম। বড়ই দু:খের বিষয়... :(									
",All friends have graduated. And I went to Inter Pass and Thailand. Very sad... :(
"ভারতের সীমান্ত রক্ষীদের উপরে যে কেমন ঘৃনা জন্মেছে তা ভাষায় প্রকাশ করা সম্ভব না :(									
",Words can't express the hatred the Indian border guards feel :(
"মাথা নষ্ট :( এত চাপ একসাথে ক্যামনে নিব?? :( সালার ক্লায়েন্ট গুলা সব একসাথে মরতাছে আর আমারে মারতাছে :( দুয়া কইরেন... http://fb.me/KcadamC5 									
",Losing my head :( How can I take so much pressure together?? :( Sala's clients are all dying together and beating me :( Praying... http://fb.me/KcadamC5
"আজকের দিনটা স্কুলের শেষ দিন ছিলো .. স্কুল জীবন টা শেষ হওয়ার কস্ট এখন ভুযতেসি :( সারাটা জীবন ভাবতাম স্কুল টা... http://fb.me/P2z56Oj2 									
",Today was the last day of school.. I feel the cost of ending school life now :( All my life I thought about school... http://fb.me/P2z56Oj2
"মাঝে মাঝে মনে হয় পৃথিবীতে কেউ কারো নয়। সময়ের প্রয়োজনে সবাই কাছে আসে আবার সময়ের ব্যাবধানে দূরে চলে যায়।. :( ~Shunno Akasher Ghuri~									
",Sometimes it seems that nobody in the world is nobody. Everyone comes near with the need of time and goes away with the gap of time. :( ~Shunno Akasher Ghuri~
"লাইফ সাপোর্ট দিয়াও কোন কাজ হচ্ছে না :( :( :( :( :( :( দেড় বছরের সম্পর্কের ইতি টানতে হবে এখানেই... গুড বাই... http://fb.me/6teviCepO 									
",Life support is not working :( :( :( :( :( :( :( :( :( :( :( :( :( :( :( :( :( :( :( :( :( :( :( :( :( :( :( :( :( :( :( :( :( :( :( :( :( :( :( :( :( :( :( :( :( :( :( :( :( :( :( :( :( :( :( :( :( :( :( :( :( :( :( :( :( :( :( :( :( :( :( :( :( :( :( :( :( :( :( :( :( :( :( :( :( :( :( :( :( :( :( :( :( :( :( :( :( :( :( :( :( :( :( :( :( :( :( :( :( :( :( :( :( :( :( :( :( :( :( :( :( :( :( :())))))))))))))))
"আসলে পৃথিবীতে আপন বলতে কেউ নেই ।									
","In fact, there is no one in the world to call your own."
"হেতের কোনো কারনে আমার চাইতে ভাল রেজাল্ট হইলে ভাবী মাইরে ফেলবো আম্রে সিউর :S									
","For some reason, if you get better results than me, I'm sure I'll kill the future :S"
"মাথা ব্যাথা... :(									
",headache... :(
"Disappointment is: বিয়ের সর্বনিন্ম বয়স নির্ধারন করে দেয়া হলেও সর্বোচ্চ বয়স নির্ধারন করে না দেয়া। :(									
",Disappointment is: The minimum age for marriage has been fixed but not the maximum age. :(
"আমার প্রিয় মোবাইলটা গেলরে! :-( আর নিয়মিত বাংলায় পোষ্ট দিতে পারবোনা! ফেসবুকও নিয়মিত চালাতে পারবোনা! :-(									
",My favorite cell phone! :-( I can't post regularly in Bengali anymore! I can't even run Facebook regularly! :-(
"মানিব্যাগে অবশেষে আর ২ টাকা বাকি রইল!!! হে আল্লাহ!!! হয় দেখা দে, নইলে এক বস্তা টাকা দে...। #feeling চুতিয়া :(									
",Finally 2 rupees left in the wallet!!! Oh Allah!!! Either show up or pay a bag of money.... #feeling chutia :(
"অনেক দিন বোম্বাস্টিং খেলি না :( :( ।									
",I haven't played Bombing for a long time :( :( .
"কি করে তোকে বলবো তুই কে আমার আয়না সাথে চলবো সব পারাপার মনেরি আসকারাতে তোর কাছে এলাম হারিয়ে গেলাম :(									
",How can I tell you who you are? I will walk with my mirror.
"নীলক্ষেত গেলে মাথা ঠিক থাকে না >:(									
","If you go to blue fields, your head will not be right >:("
"বিরুক্তি কর সব কিছু :-(:-(:-(:-(:-(:-(:-(:-(									
",Disgust everything :-(:-(:-(:-(:-(:-(:-(:-()
"বেটা বদমাইশ !!!! >:( http://fb.me/1pY9Ot7KD 									
",Betta bastard!!!! >:( http://fb.me/1pY9Ot7KD
"আমি আর খেলব না। :(									
",I won't play anymore. :(
