Text,translated_text
"কেন জানি খুব খারাপ লাগতেছে!! :( পায়ের নিচে সিঁড়ি খুজে পাচ্ছি না।									
",I know why it feels so bad!! :( I can't find the stairs under my feet.
"পাল্টে গেছে সবাই, আমিই পাল্টাতে পারলাম না......being নস্টালজিক :(									
","Everyone has changed, I couldn't change......being nostalgic :("
"এক বুক ব্যাথা নিয়ে বলছি ""আমি এক অসহায় চুয়েটিয়ান""। :-( :-(									
","Saying with a chest pain ""I am a helpless Chuetian"". :-( :-("
"ইতিহাসের সবচেয়ে বড় ঝড় ফিলিপিন্সে, মৃতের সংখ্যা ১০০ ছাড়ল :( ইতিহাসের সবচেয়ে বড় ঝড়ে ফিলিপিন্সের তিনতলা বাড়ি... http://fb.me/2wcMAgUrj 									
","Biggest typhoon in history in Philippines, death toll exceeds 100 :( Biggest typhoon in history destroys three-story house in Philippines... http://fb.me/2wcMAgUrj"
"না জ্যাম আর সহ্য হয় না :(									
",No more jamming :(
"রাস্তায় বাহির হইছ তো মরছ :(									
","If you go out on the street, you die :("
"যশোরের অভয়নগরে বোমাহামলায় আওয়ামী লীগের এক নেতা নিহত হয়েছেন। :(									
",An Awami League leader was killed in a bomb attack in Jessore's Abhaynagar. :(
"Rashikin Saddid আমার মার্কেট ত শ্যাষ রে মাম্মা :( আমি শ্যাষ! নিঃস্ব, দেউলিয়া হয়্যা গেলাম :(									
","Rashikin Saddid my market t shash re mamma :( I am shash! destitute, bankrupt :("
"মন ভালো নাই ...। চললাম ঘুমের খোঁজে :(									
",I'm not feeling well... I went to sleep :(
"অশ্বিন বিশ্বসেরা অলরাউন্ডার ? তোরা কেও আমারে মারবি না আমি নিজেই মইরা জামু ? :(									
","Ashwin the world's best all-rounder? You will not beat me, I myself Moira Jamu? :("
"সাংঘাতিক রকম মন খারাপ করে দেওয়ার মতো একটা লেখা... :( http://fb.me/Pt7bkp0h 									
",A seriously depressing post... :( http://fb.me/Pt7bkp0h
":( ভয়াবহ প্রলয়ঙ্করী ঘূর্ণিঝড় হাইয়ানের আঘাতে ফিলিপাইনে এখন পর্যন্ত ১২০০-র বেশি মানুষ নিহত হয়েছে।									
",:( So far more than 1200 people have been killed in the Philippines due to the terrible typhoon Haiyan.
"যখন তোমার ছবি দেখি তখন মনে হয় তোমার দেওয়া সব কষ্ট আমি ভুলে গেছি :( নতুন করে যেন সব কিছু শুরু হবে ,নতুন একটা... http://fb.me/32gZM2ClL 									
","When I look at your picture, I feel like I forgot all the pain you gave me :( It's like everything starts anew, a new... http://fb.me/32gZM2ClL"
"টাকার কাছে শখেরা আজ মৃত। :(									
",Love for money is dead today. :(
"মাথা ব্যাথা করতেছে :(									
",headache :(
"আমি ব্যর্থ , আহত নিহত ও মর্মাহত । সাত সকালে এই শট যে আমারে #trisha আফা ক্যান দিলো :( :'( ""amar baga... http://fb.me/18O9O1mUA 									
","I failed, wounded, killed and shocked. This is the shot that #trisha gave me in the morning :( :'( ""amar baga... http://fb.me/18O9O1mUA"
"অশিক্ষিতদের সাথে কথায় পারা যায় না। এরা আম গাছে জাম ফলাইতে পারে। Unbelievable >:(									
",Unable to talk with uneducated people. They can produce jam on mango trees. Unbelievable >:(
"আস্তে আস্তে জীবনের ভালো দিন গুলো ফুরিয়ে যাচ্ছে :( কিন্তু স্বপ্ন টা অধরাই রয়ে গেলো।									
",Slowly the good days of life are running out :( But the dream remains elusive.
"সকাল ৮টা থেকে পল্লী বিদ্যুত কর্তৃপক্ষ অঘোষিত বিদ্যুত সরবরাহ বন্ধ রেখেছে, এদিকে জেনারেটর নষ্ট ৷ :( দিনটাই মাটি","The Rural Electricity Authority has stopped the unannounced power supply since 8 am, while the generator is broken. :( The day is soil"
"﻿#AkashDeep ""আকাশপ্রদীপ জ্বলে . ."" #Diwali coming...The #Festival of #Light is near. #HappyDiwali :) Happy #Deepabali https://www.facebook.com/photo.php?
","﻿#AkashDeep ""AkashDeep lights up . . ."" #Diwali coming...The #Festival of #Light is near. #HappyDiwali :) Happy #Deepabali https://www.facebook.com/photo.php?"
"#good_night_শুভরাত্রি একটি সূর্য আবার অস্ত যাচ্ছে,একটি রাত এর জন্ম হচ্ছে!! http://buff.ly/18ZO47f  pic.twitter.com/TIWS6WNpMy
","#good_night_शुवरात्र A sun is setting again, a night is being born!! http://buff.ly/18ZO47f pic.twitter.com/TIWS6WNpMy"
"* Good Morning* মামারা ঘুম থেকে কি কেউ উঠলা? আমি কিন্তু উঠছি।।তোমরা কেউ উঠলে লাইক মেরে কমেন্টে আসো।একটু সকাল বেলা... http://fb.me/1wi7IrN1K 
","* Good Morning * Did anyone wake up? But I'm getting up.. If you get up, please like and comment. It's a little early in the morning... http://fb.me/1wi7IrN1K"
"* শুভ রাত্রি * . . . * GOOD NIGHT *
",* good night * . . . * GOOD NIGHT *
";-):-D:-D পাকিস্তান হারছে রে কি মজা !প্রোটিয়াস আর দ্য বিউটি:-)
",;-):-D:-D Pakistan is losing what fun!Proteus and the beauty:-)
"@FarahPiani: সব ঝামেলা আমার সাথেই হয় ক্যান! :(কারন তুমি নিজেই একটা ঝামেলা তাই
",@FarahPiani: All the trouble is with me! :( Because you are a trouble yourself
"@iam_koni দিদিঃ ভেবেছিলাম, চ্যানেলে চ্যানেলে প্রচুর বাজবে মান্না দে'র গান; বাজেনি! শুধুই খবর: 'তাঁর মহাপ্রয়াণ'!
",@iam_koni Didi: I thought Manna Dey's song will play a lot on channels; Didn't ring! Only news: 'His death'!
"@jeet30 Good Night sona dada.....শুভ রাত্রি :)
",@jeet30 Good Night sona dada.....good night :)
"@SarimKhan ভাল করেছ :v
",@SarimKhan well done :v
"@shreyaghoshal শুভ রাত্রি। ভাল থেকো। :) :)
",@shreyaghoshal Good night. stay well :) :)
"@We_Love_Mir বছরের এই আনন্দময় দিনটি তার সবটুকু রঙে তোমায় রাঙিয়ে দিক,উৎসবের প্রতিটি মুহূর্ত হয়ে উঠুক আরো উজ্জ্বল। ঈদ 
","@We_Love_Mir May this auspicious day of the year paint you with all its colors, May every moment of the festival be brighter. Eid"
"♥ Good Morning ♥ ঘুম ঘুম রাত শেষে, সূর্য আবার উঠলো হেসে ফুটলো আবার ভোরের আলো,, দিনটা সবার কাটুক ভালো .. শুরু হল... http://fb.me/6BeAosu4y 
","♥ Good Morning ♥ Sleep Sleep At the end of the night, the sun rose again, smiled, and the light of the morning,, have a good day everyone.. Started... http://fb.me/6BeAosu4y"
"১২-১৫ তা দোকানে আগুন ধরিয়ে দেয়া হয়েছে :(
",12-15 The shop was set on fire :(
"২০১৩ সালের সেরা কাপল, সবাই দোয়া করবেন :P http://fb.me/2sIu8H2Dk 
","Best couple of 2013, everyone pray :P http://fb.me/2sIu8H2Dk"
"Alhamdulillah, আমি হাঁটতে পারি :) http://fb.me/2I3zdqeGm 
","Alhamdulillah, I can walk :) http://fb.me/2I3zdqeGm"
"AmnI ColD n Fever A seSh hYa JaiTesi TaR upoR abR polApaIn ফুটো টাগায়না শুরু কস্সে :( :( :'( #কোইযেযামুবাপু !!!
",AmnI ColD n Fever A seSh hYa JaiTesi TaR upoR abR polApaIn futo tagayna start kasse :( :( :'( #कोयजेज़मुबपु !!!
"Asian Tv তে এসিয়ান মিউজিক আওয়ার এক্কেবারে জমিয়ে দিছে। বেশ উপভোগ করছি :)
",Asian Music Hour on Asian Tv at eleven o'clock. Enjoying it :)
"Describe what a good friend means to you? — যার সাথে কোন কারন ছাড়া ঘন্টার পর ঘন্টা কথা বলা যায়, এক কথা বার বার ব... http://ask.fm/a/a045hbni 
","Describe what a good friend means to you? — Someone you can talk to for hours for no reason, saying the same thing over and over... http://ask.fm/a/a045hbni"
"Eating মুরগি Feeling শেয়াল :D :D
",Eating chicken Feeling fox :D :D
"Feeling - sleepy কিন্তু ইচ্ছা করতেসে না কি করি
",Feeling - sleepy but I don't want to do anything
"Feeling a sad :( ভালোবাসা নাম'এ পেজ গুলো দেখতে মনে চায় না .....
",Feeling a sad :( I don't want to see the pages in the name of love.....
"Feeling যা আছে কপালে ! :'(
",Feeling what is on the forehead! :'(
"Feeling-বমি বমি খালেদার ফোনালাপ শুনে।
",Feeling-nausea listening to Khaleda's phone conversation.
"FIFA OST গুলো এবার জোস হইছে অনেক :D
",FIFA OSTs are now very popular :D
"Good Morning .. কাউকে আবেগের. ভালোবাসা দিওনা, মনের ভালোবাসা দিও............. কারন আবেগের ভালবাসা একদিন বিবেকের কাছে হেরে যাবে
","Good Morning .. someone's emotions. Don't give love, give love of heart............. because emotional love will one day lose to conscience"
"good night ফেসবুক!
",Good night Facebook!
"Happiness Is ১৮৪ টার্গেট নিতে যাই পাকিস্তান ১৮২ তে অলআউট !! ১ রানে হাইরা গেলো! শেষ ১৭ রানে ৬ উইকেট !! :v :p... http://fb.me/SNROUiGh 
",Happiness Is 184 to take the target Pakistan 182 all out !! 1 run Hira went! 6 wickets in the last 17 runs!! :v :p... http://fb.me/SNROUiGh
"Happy birthday, Maa !! Love you !! শুভ জন্মদিন মা !! pic.twitter.com/aeCrMFBn6R
",Happy birthday Maa !! Love you!! Happy birthday mom!! pic.twitter.com/aeCrMFBn6R
"Hi frnds good morning. আমি এই পেজ এর নতুন এডমিন #ovi...... 8-)
",Hi frnds good morning. I am the new admin of this page #ovi...... 8-)
"How to make a woman happy? — ''হ্যাপি'' নামের কাউকে সেই উইমেনের কাছে নিয়ে যান, তাহলেই তো সে বলবে, হ্যাপি !!!!! ... http://ask.fm/a/a0hn779i 
","How to make a woman happy? — Take someone named ``Happy'' to that woman, and she will say, ``Happy!!!!!'' ... http://ask.fm/a/a0hn779i"
"http://www.youtube.com/watch?v=AC_QkM3iMNY … ঝিনুক আমার জান, কেউ কেড়ে নিতে চাইলে টাকে মৃত্যু করবো দান! :P নিজের... http://fb.me/19ccPZF8w 
","http://www.youtube.com/watch?v=AC_QkM3iMNY … Oysters, my dear, if someone wants to take them away, I will give them death! :P own... http://fb.me/19ccPZF8w"
"I was taking bath in গোসলখানা... হঠাৎ I am feeling কিছুএকটা is বাইয়া উঠতাছে by my পা !!! I was just হতভম্ব! I... http://fb.me/12U0RpSnk 
",I was taking bath in the bathroom... suddenly I am feeling something is coming up by my feet!!! I was just shocked! I... http://fb.me/12U0RpSnk
"Like our Post or comment to be always with us. Thank you. “বিসমিল্লাহির রাহমানির রাহিম” আসসালামু আলাইকুম... http://fb.me/30vriOCPw 
",Like our post or comment to be always with us. Thank you. “Bismillahir Rahmanir Rahim” Assalamu Alaikum... http://fb.me/30vriOCPw
"Now I'm at kazir dewri , Kazi Bari Ln, Chittagong http://goo.gl/maps/kS7MV  অনেক দিন পর ফ্রেন্ডদের সাথে আড্ডা দিচ্ছি ঃ)
","Now I'm at kazir dewri, Kazi Bari Ln, Chittagong http://goo.gl/maps/kS7MV Chatting with friends after a long time :)"
"Really??!! একাত্তর টিভির পক্ষে সবই সম্ভব! http://fb.me/34UyrH9x5 
",Really??!! Everything is possible for seventy-one TV! http://fb.me/34UyrH9x5
"Sunday-Monday & days wanna kill you again and again!! >:( [কারো হার্টের সমস্যা থাকলে না দেখাই ভালো, আমি যাই... http://fb.me/6wYDT2Phm 
","Sunday-Monday & days wanna kill you again and again!! >:( [If anyone has a heart problem better not show, I go… http://fb.me/6wYDT2Phm"
"Tor Dabi Ta Ki Vai? ? ? ? :-/ :-/ :-/ #feeling কনফিউজ
",Tor Dabi Ta Ki Vai? ? ? ? :-/ :-/ :-/ #feeling confused
"wow!! the snail is fast :D Tarbo দেইখা মজা পাইছি :)
",wow!! the snail is fast :D Enjoyed watching Tarbo :)
"অতীতে নাহয় একটু গাপলা আছে, আপাতত সামনে যাই :D :D অতীত টপিক উঠলেই সামনে যাইতে মন চায় ;)
","There is a little gap in the past, let's go forward for now :D :D When the past topic comes up, I want to go forward ;)"
"অনেক সময় চোখের জলকে আগুনে পরিণত করতে হয় :(
",Sometimes tears have to be turned into fire :(
"অনেকদিন পরে বরিশালে পা রেখে কেমন যেন নিজের শহর নিজের শহর মনে হচ্ছে। I am feeling different.
",Stepping into Barisal after a long time feels like one's own city. I am feeling different.
"অনন্ত জলিল বাল , আর হিন্দি নায়কদের অবাস্তব জিনিসও ভালা। টিপিকাল বাঙ্গালী :(
","Anant Jalil Bal , and Unreal Stuff by Hindi Nayaks are also good. Typical Bengali :("
"অপেক্ষা ব্যপারটা কত খারাপ লাগে, সেটা তখনই বুঝি যখন... . . . . . . . . . কোন কিছু ডাউনলোড দিয়া, সেটার জন্য বসে থাকি! :(
","I understand how bad the waiting is when... . . . . . . . . . By downloading something, I sit for it! :("
"অর্থহীণ পৃথিবী....নির্মম সবকিছুু... .হতাশার আগ্রাসন...:(
",Meaningless world....brutal everything... .the onslaught of despair... :(
"অসৎ সঙ্গ সর্বদা পরিহার করা উচিত :)
",Dishonest company should always be avoided :)
"আগে রাত হইলে আমি , অমি ভাই , শান , সাইফ , চাক্কু টুইটের পশরা নিয়ে বসতাম . আর এখন টি এল খালি . :(
","Earlier, when it was night, I, my brother, Shaan, Saif, Chakku used to sit with tweets. And now it is empty. :("
"আগুনের লেলিহান শিখা থামছেই না :((
",The flames don't stop :((
"আজকে জীবনে ককটেল এর আওয়াজ এত কাছ থেকে শুনলাম। :3 ভয় পাইছি :(
",Today in life I heard the voice of the cocktail so closely. :3 I'm scared :(
"আজকে সব কিছু এত নিরব নিরব কেন ? সব কিছুতেই পানসা পানসা একটা স্বাদ অনুভব হইতেছে :( আমার একার হইতেছে নাকি আপনাদেরও ?
",Why is everything so quiet today? There is a pansa pansa taste in everything :( Is it just me or yours too?
"আজকের মত বিদায় নিচ্ছি সব বন্ধুর কাছ থেকে… বেঁচে থাকলে কাল আবার দেখা হবে, কথা হবে….... good night my sweet frndzzzzzzzzzzzzzzzz♥♡
","Today I am saying goodbye to all my friends... If I am alive, I will meet again tomorrow, we will talk.... good night my sweet frndzzzzzzzzzzzzzzzz♥♡"
"আফসোস একটাই বস \মাশরাফি/ উইকেট পাইলনা
",Pity only boss \Mashrafi/ didn't get a wicket
"আমাদের উপকারী আপা......... সত্যি আপা, আপনার তুলনা হয় নাহ :) http://fb.me/11gm9RgFW 
",You are our benefactor......... really you are incomparable :) http://fb.me/11gm9RgFW
"আমাদের ঘুরতে যাওয়ার কোনো জায়গা নাই। তাই বসে আছি। :(
",We have nowhere to go. So I am sitting. :(
"আমাদের ছোট্ট মুসির মুখে হাসি দেখছেন? উইকেট নিলে সবার আগে দৌড় দিয়ে বোলার এর কাসে যায় :পি kaiF 
","See the smile on our little Musi's face? If a wicket is taken, the first person runs to the bowler :P kaiF"
"আমাদের টিভি চ্যানেলগুলির স্ক্রলে বানান ভূলের মহড়া দেখে বিনুদিত :(
",Amused by the practice of spelling mistakes in scrolling our TV channels :(
"আমি সত্যিই সাকা চৌধুরীকে বহু মিস করি! বাংলাদেশ পলিটিক্স এ তিনিই এক মাত্র দিলদার (অভিনেতা দিলদারের কথা কইলাম) :P
",I really miss Saka Chowdhury a lot! He is the only Dildar in Bangladesh politics (talking about actor Dildar) :P
"আরো একদিন :( সময় দেখি শেষ হয়না :( Can't Wait For #ElClasico #ClasicFCB
",One more day :( Time never ends :( Can't Wait For #ElClasico #ClasicFCB
"আল্লাহ তুমি মাহমুদুল্লাহ রিয়াদ এর ফর্ম ফিরায় দাও। সবাই বলেন আমিন :)
",May Allah return the form of Mahmudullah Riyad. Everyone says Amen :)
"আলসেমি লাগছে, দিন দিন অলস হয়ে যাচ্ছি:-(
","Feeling sick, getting lazy day by day :-("
"আশা ছিল ভালবাসাও ছিলও, আজ আশা নাই ভালবাসাও নাই :( :(
","There was hope and love, today there is no hope and no love :( :("
"আস্তাগফিরুল্লা, বেগম জিয়ার লেকচার শুনা থেকে বঞ্চিত করলু লুডশেডিং :(
","Astaghfirullah, deprived of listening to Begum Zia's lecture, Karlu Ludshedding :("
"আস্তে কইরা একটা কথা কই সবাই কে, শুনেন কইতেছি,  ............GOOD NIGHT..............
","Say a word slowly everyone, hear me say, ............GOOD NIGHT.............."
"আসলে তাকে গুলি করার পর এমন ভাবে টেনে রাস্তার পাশে ফেলে রাখা হয়েছিল যে সবাই ভেবেছিল তিনি মারা গেছেন :(
","In fact, after being shot, he was dragged to the side of the road in such a way that everyone thought he was dead :("
"আয়ারল্যান্ড যাইতে মন চায়। আয়ারল্যান্ড এত্তো এত্তো সুন্দর কেন?????? Feeling সো মাচ রুমান্টিক!!!!
",I want to go to Ireland. Why is Ireland so beautiful?????? Feeling so much romantic!!!!
"ইন শা আল্লাহ কাল কেও আমরা জিতব :D
",In Sha Allah we will win tomorrow :D
"ইনজুরিতে পরেছেন আমাদের মার্সেলো মামু, :( ব্রাজিলের হয়ে সামনের ম্যাচগুলো মিস করবেন তিনি। গেট ওয়েল সুন... http://fb.me/1SchXD9CD 
","Our Marcelo Mamou is injured, :( He will miss the upcoming matches for Brazil. Get well soon... http://fb.me/1SchXD9CD"
"ইন্টারেস্টিং......
",Interesting......
"ইস, বাংলাদেশে এই আইনটা থাকা যে কী জরুরী... :( http://fb.me/1Pgnq34c6 
","Yes, it is important to have this law in Bangladesh... :( http://fb.me/1Pgnq34c6"
"উফ্‌! খুব পা ব্যথা করতেছে :(
",Oops! My feet hurt so much :(
"এই অল্প ক'টা দিনে কী করে এতটা বোঝো আমাকে? u simply mk me feeling so lucky to hv a frnd, a person lyk u in my life... #goody_woody
","How do you understand me so much in these few days? u simply mk me feeling so lucky to hv a frnd, a person lyk u in my life... #goody_woody"
"এই অসম্ভব সুন্দর গানটার artist আমার বন্ধু Shahnewaz Piash :) http://fb.me/159zpN917 
",The artist of this beautiful song is my friend Shahnewaz Piash :) http://fb.me/159zpN917
"এই কূলে আমি আর ঐ কূলে তুমি মাঝখানে নদী ঐ বয়ে চলে যায়.... যে কূলেই থাকুন, ভালো থাকুন প্রিয় মান্নাদে — feeling sad.
","I am on this side and you are on that side, the river flows in the middle.... Stay in any side, stay well dear Mannade — feeling sad."
"এই গরিব দেশের ভবিস্যত অন্ধকার :(
",The future of this poor country is dark :(
"এক ঝাক তারকা বিহীন আর্জেন্টিনা লড়ে যাচ্ছে সমান গতিতে। গর্জে উঠো আর্জেন্টিনা আর্জেন্টিনা =১ (মেক্সি রুদ্রিগুয়েজ) উরুগুয়ের = ১ 
","Without a star star, Argentina is fighting at an even pace. Roar Argentina Argentina =1 (Mexi Rodriguez) Uruguay =1"
"একটু আগে আমাদের বাজারে ৪গাড়ি বিজিবি এসেছিলো! ফাকা আইলো ফাকাই গেলো! :-(
","A little while ago, 4 cars BGB came to our market! Faka Ilo Faka gone! :-("
"একটু ফটোশপে গুতাগুতি করলুম আর কি :P https://www.dropbox.com/s/bo8jc75ch533efu/Happy-New-Year-2014.jpg … http://fb.me/11fbyw7YT 
",Just dabbled in photoshop and whatnot :P https://www.dropbox.com/s/bo8jc75ch533efu/Happy-New-Year-2014.jpg … http://fb.me/11fbyw7YT
"একদিন ১টি চুড়ই পাখি ১টি সাদা গোলাপের কাছে গিয়ে বলল, I LOVE U তখন গোলাপ পাখিটিকে বলল যে দিন আমি সাদা থেকে লাল রং... http://fb.me/21msHj7Mv 
","One day a bird went to a white rose and said, I LOVE U then the rose told the bird that day I changed from white to red... http://fb.me/21msHj7Mv"
"একমত! ""@dk_sadia: Happiness is অক্টোবরের আবহাওয়ায় ফ্যান চালাইয়া কাঁথা গায়ে দিয়ে ঘুমানো :)""
","Agree! ""@dk_sadia: Happiness is sleeping with a fan on in October weather :)"""
"এক্সাম !! একমাত্র ভরসা হরতাল :( :(
",Exam !! Only hope strike :( :(
"এখন থেকে আমি আর গার্ল ফ্রেন্ড এর সাথে ফোনে রোমান্টিক, এক্সাইটেড কথা কমু না :( :( :( এক্কেরে কানে ধরছি :'( ভয়... http://fb.me/17aPN8VxM 
","From now on I don't have romantic, excited talk on the phone with my girlfriend anymore :( :( :( I'm catching it in my ear :'( fear... http://fb.me/17aPN8VxM"
